StartDate,EndDate,Progress,Duration (in seconds),Finished,RecordedDate,Informed Consent,Q20_1,Q20_2,Q20_3,Q20_4,Q20_5,Q20_6,Q20_7,Q20_8,Q20_9,Q20_10,Q20_11,Q20_12,Q20_13,Q20_14,Q20_15,Q20_16,Q20_17,Q20_18,Q20_19,Q20_20,Q20_DO_1,Q20_DO_2,Q20_DO_3,Q20_DO_4,Q20_DO_5,Q20_DO_6,Q20_DO_7,Q20_DO_8,Q20_DO_9,Q20_DO_10,Q20_DO_11,Q20_DO_12,Q20_DO_13,Q20_DO_14,Q20_DO_15,Q20_DO_16,Q20_DO_17,Q20_DO_18,Q20_DO_19,Q20_DO_20,Q1_1,Q1_2,Q1_3,Q1_4,Q1_5,Q1_6,Q1_7,Q1_8,Q1_9,Q1_10,Q1_11,Q1_12,Q1_13,Q1_14,Q1_15,Q1_16,Q1_17,Q1_18,Q1_19,Q1_DO_1,Q1_DO_2,Q1_DO_3,Q1_DO_4,Q1_DO_5,Q1_DO_6,Q1_DO_7,Q1_DO_8,Q1_DO_9,Q1_DO_10,Q1_DO_11,Q1_DO_12,Q1_DO_13,Q1_DO_14,Q1_DO_15,Q1_DO_16,Q1_DO_17,Q1_DO_18,Q1_DO_19,Q32,Q22_1,Q22_2,Q22_3,Q22_4,Q22_5,Q22_6,Q22_7,Q22_DO_1,Q22_DO_2,Q22_DO_3,Q22_DO_4,Q22_DO_5,Q22_DO_6,Q22_DO_7,Q21_1,Q21_2,Q21_3,Q21_4,Q21_5,Q21_6,Q21_7,Q21_8,Q21_9,Q21_10,Q21_DO_1,Q21_DO_2,Q21_DO_3,Q21_DO_4,Q21_DO_5,Q21_DO_6,Q21_DO_7,Q21_DO_8,Q21_DO_9,Q21_DO_10,Q24,Q33,Q34,Q29,Q28,Q28_27_TEXT,SC0,TWIN_ID,
6/11/2025 11:09,6/11/2025 11:22,100,749,1,6/11/2025 11:22,1,4,4,5,4,4,3,5,4,2,4,4,5,2,4,4,5,4,4,2,4,7,11,18,1,20,2,9,16,6,12,17,13,8,19,4,14,15,5,3,10,4,5,4,4,2,4,3,5,5,4,4,4,5,5,4,4,5,5,5,13,7,9,19,14,18,4,11,1,3,8,6,16,17,12,15,10,2,5,3,5,5,3,5,5,5,1,1,4,5,3,7,2,6,4,5,1,5,2,5,4,2,4,5,1,7,8,9,10,6,2,3,5,4,5,1,"This company has lost sales from 20022 to 2023 also the call center complaints have risen high in the last year. also complaints have over doubled in a year, and service personnel turn over is vey high, I think this is do to very bad management ",3,27,Agriculture Consulting ,262,927,
6/10/2025 16:59,6/10/2025 17:13,100,833,1,6/10/2025 17:13,1,4,5,4,4,3,5,4,4,2,4,3,3,3,4,4,5,4,5,2,5,7,5,11,1,20,4,13,9,6,17,8,10,14,12,18,2,19,3,16,15,5,1,5,4,1,3,4,4,4,5,4,5,5,4,5,4,5,4,3,5,10,3,13,9,17,18,16,11,15,8,2,19,14,6,7,4,1,12,-3,4,4,5,4,4,4,2,7,3,4,5,6,2,1,2,3,4,2,4,2,3,3,2,5,10,7,2,9,4,6,3,5,8,1,1,1,"Their product is worsening, and they haven't gotten to the source of the problem or refuse to do anything about it. People are complaining, and yet management doesn't put resources into finding out why and working towards a proper fix that'd yield them better statistics. As a result, people are leaving the company, the complaints further stack up due to lack fo personnel and the problem continues to worsen due to the declining company.",5,16,,228,928,
6/10/2025 11:57,6/10/2025 12:00,100,178,1,6/10/2025 12:00,1,4,4,4,4,4,4,4,4,2,4,4,4,1,4,4,4,4,4,1,4,5,9,2,16,12,7,6,20,18,4,13,19,10,8,17,14,15,11,1,3,2,4,4,4,4,4,4,4,4,5,4,4,4,4,4,4,4,4,4,8,3,5,7,16,15,2,10,4,1,13,9,12,14,18,17,19,11,6,-3,4,4,4,4,5,4,3,5,6,2,3,4,1,7,4,4,4,4,4,4,4,4,3,5,6,8,2,4,1,7,10,5,3,9,4,3,It seems acording to the data they are not providing a good service and getting a lot of compliants and in term their revenue is going down with more customers.,2,17,,235,929,
6/10/2025 15:10,6/10/2025 15:19,100,485,1,6/10/2025 15:19,1,5,4,4,4,3,4,5,5,2,3,3,4,2,2,5,5,3,4,3,3,9,16,11,4,20,5,3,17,15,12,14,6,1,2,10,18,7,8,19,13,4,3,3,4,3,2,3,5,4,3,2,5,3,4,2,3,4,3,3,5,16,3,8,4,11,10,6,7,12,19,1,13,2,15,18,14,17,9,-3,3,4,3,3,4,4,4,5,1,3,4,2,6,7,4,4,3,4,4,3,4,2,3,5,1,6,7,4,3,9,10,8,5,2,4,4,"From what I can tell, this company is not focusing on customer service and are pushing things aside that should be addressed by the consumers. It appears workers are unhappy and leaving the company, which in turn would lead to the higher amount of complaints being submitted. With higher complaints comes more publicity from the consumers who are leaving a bad name regarding the product, which is driving sales down. ",9,18,,223,930,
6/10/2025 13:22,6/10/2025 13:32,100,596,1,6/10/2025 13:32,1,4,3,2,3,3,3,4,4,2,2,2,2,4,3,4,5,4,3,3,4,6,9,19,7,12,1,13,17,3,15,18,16,2,20,11,5,4,14,10,8,4,3,4,4,2,3,4,4,3,4,2,4,4,4,3,4,4,5,4,7,12,13,15,6,18,16,9,5,8,4,2,11,17,14,10,19,1,3,-3,1,1,1,1,1,1,1,6,7,2,4,3,1,5,1,1,1,1,1,1,1,1,1,5,6,8,3,10,4,7,5,1,9,2,5,4,"Their sales went down, complaints went up with more complaints unresolved and more personnel turn-over. This means the company is not focusing on their customers and resolving issues.",5,27,retired and no longer working,197,931,
6/10/2025 15:12,6/10/2025 15:28,100,916,1,6/10/2025 15:28,1,2,2,4,1,3,2,5,4,2,3,1,2,4,2,5,5,3,4,3,5,10,5,1,6,7,13,15,14,2,18,20,17,11,16,19,8,12,4,3,9,3,3,3,2,3,2,3,5,5,3,3,4,4,4,2,2,4,3,2,2,16,4,11,13,1,18,12,7,5,8,9,15,19,6,10,17,14,3,-3,3,5,1,3,3,4,3,2,6,1,4,3,5,7,3,5,3,3,4,5,4,2,5,5,1,10,6,9,2,5,3,8,4,7,4,1,it seems that in 2023 something happened ether new management or something because revenue went down and complaints went up but about 50 thousand in just one year ,9,13,,197,932,
6/14/2025 13:46,6/14/2025 13:59,100,751,1,6/14/2025 13:59,1,4,5,4,4,4,2,5,5,2,4,5,3,5,3,5,5,5,5,2,5,8,13,15,7,6,14,19,18,1,2,4,11,10,17,20,3,9,5,16,12,5,3,4,5,3,4,5,5,5,5,2,4,4,4,4,5,3,5,3,9,4,18,11,14,17,15,3,8,16,6,1,13,2,5,10,19,7,12,-3,4,4,4,4,4,5,2,4,3,5,6,7,1,2,4,5,2,5,3,5,3,3,5,5,6,7,8,4,10,1,9,2,5,3,4,2,"The data shows that between 2022 and 2023 many problems have increased!  Sales are down, complaints to the call center are up by 50%, customer complaints have not been resolved, and employees aren't happy working at this company as there is a huge turnover of personnel.  Clearly, management isn't doing their job, and this is reflected across the board.",7,22,,256,933,
6/10/2025 12:18,6/10/2025 12:26,100,490,1,6/10/2025 12:26,1,5,4,3,4,5,4,5,5,2,3,3,4,2,5,5,5,5,3,1,5,4,2,3,16,18,1,12,19,15,20,10,13,14,9,5,17,11,6,8,7,4,5,3,5,1,3,3,5,5,4,2,5,5,4,3,4,5,5,5,5,18,2,17,8,10,12,7,13,14,1,15,19,16,6,4,3,11,9,-3,5,5,5,5,5,5,1,4,2,6,5,3,1,7,3,5,1,5,1,5,5,1,5,5,8,7,5,6,9,3,10,1,4,2,4,2,"Sales have decreased by $2 million. Complaints have increased by the thousands, and these complaints are not being resolved. Turnover has also increased. Something negative is going on with this company.",9,25,,272,934,
6/16/2025 12:28,6/16/2025 12:35,100,393,1,6/16/2025 12:35,1,4,4,2,3,3,4,4,3,2,2,2,3,2,2,3,3,4,2,3,4,2,10,3,5,8,4,13,7,9,19,12,15,14,17,20,16,6,18,11,1,2,2,3,3,3,2,4,4,3,4,5,4,2,2,4,2,3,1,3,4,3,19,6,7,5,18,1,2,9,17,13,12,15,8,11,10,16,14,-3,5,5,5,5,3,3,5,2,7,1,3,5,6,4,2,3,3,3,3,2,3,3,3,5,4,9,10,7,8,3,5,2,6,1,5,2,"The company seems to have suffered a severe disruption in their management and sales between 2022 and 2023, with sales decreases, increased complaints and unhappy workers that hinder the company growing",9,19,,196,935,
6/10/2025 10:07,6/10/2025 10:27,100,1234,1,6/10/2025 10:27,1,2,4,4,3,2,5,4,5,2,1,2,1,4,3,2,4,3,5,4,5,17,18,16,20,10,19,4,12,7,9,6,11,15,3,8,2,13,5,1,14,4,2,5,5,2,3,3,5,4,4,3,3,2,5,1,2,2,4,3,11,6,3,5,12,14,17,9,10,8,2,18,19,13,7,15,4,1,16,-3,1,1,3,1,2,3,5,5,1,6,2,4,3,7,2,3,3,4,3,2,1,2,1,5,10,9,8,5,4,3,1,7,6,2,5,4,"It appears that complaints are rising customer service numbers are declining, and there is much employee turnover When compared to 2022 and 2023",7,27,Higher education administration,198,936,
6/10/2025 9:40,6/10/2025 9:47,100,465,1,6/10/2025 9:47,1,3,4,3,4,4,5,4,4,2,2,3,2,3,4,4,4,4,4,2,4,11,1,19,18,17,3,9,2,10,14,20,5,16,6,4,8,12,13,15,7,4,3,2,4,2,2,2,2,4,4,3,4,3,4,4,4,4,4,4,14,7,4,8,13,10,12,19,2,1,9,6,15,18,16,17,5,11,3,-3,4,4,4,5,4,4,2,7,4,3,5,2,1,6,4,4,2,3,2,4,4,2,4,5,8,2,10,4,3,5,9,6,1,7,4,4,It looks like from 2022 to 2023 they lost a fair bit ($2 million dollars) worth of sales and their call center complaints rose by fifty thousand. In that same time period complaints started going unresolved and the service personnel started to quit more frequently. They seem to be having a hard time growing and responding to consumers needs adequately. ,3,13,,217,938,
6/14/2025 23:08,6/14/2025 23:25,100,1061,1,6/14/2025 23:25,1,1,3,1,3,4,4,4,4,2,1,1,2,2,3,3,4,4,4,2,4,2,20,15,17,3,9,10,8,13,6,18,19,5,4,7,1,16,11,14,12,4,4,4,4,2,3,4,4,5,5,4,4,4,3,4,3,5,3,2,19,18,7,16,3,10,8,13,6,11,14,12,5,9,15,4,17,1,2,-3,5,3,5,2,4,5,2,6,7,5,1,4,2,3,4,3,2,4,2,5,4,1,4,5,9,8,10,4,6,7,1,5,2,3,1,2,"According to the data for this company, there is evidence as to why the company declined from 2022 to 2023. Let's begin with ""Service personnel turn-over"". In 2022, the turn-over was 10%, compared to 25% in 2023. This increase alone could cause major financial losses in a business. In 2023 there were 25% more ""Complaints not resolved"" than in 2022. In addition, ""Call center complaints"" increased in 2023 by 50K. Lastly, because of the decline in productivity, company sales decreased in 2023 by 2M",2,13,,205,939,
6/10/2025 12:59,6/10/2025 13:07,100,447,1,6/10/2025 13:07,1,4,4,3,4,4,5,4,4,2,3,3,5,2,3,4,4,5,4,2,5,1,6,16,4,5,14,20,15,17,3,12,18,2,19,10,9,11,8,7,13,5,4,4,4,1,3,2,3,4,5,1,4,2,4,3,4,5,4,4,2,12,19,10,17,4,6,16,14,5,18,11,1,15,8,7,9,13,3,-3,4,4,3,2,2,4,3,3,6,7,1,2,4,5,2,2,4,1,4,2,2,2,2,5,3,8,2,10,7,6,4,9,5,1,1,1,The company lost sales due to service personnel loss. When the call centers are constantly training people they are taking time away from the personnel best equipped to handle and resolve complaints. This increases the amount of complaints received and decreases the amount of complaints that can be resolved. ,6,19,,217,940,
6/10/2025 10:20,6/10/2025 10:40,100,1228,1,6/10/2025 10:40,1,5,5,3,3,3,3,5,3,2,3,3,5,5,5,5,5,5,4,1,5,1,14,7,6,3,16,12,9,8,2,20,19,10,13,18,15,11,17,4,5,5,3,5,5,1,3,5,5,5,5,5,5,5,5,5,5,5,5,5,1,4,9,2,18,12,7,13,14,5,17,10,8,19,6,15,16,3,11,3,3,3,3,3,4,3,3,4,6,1,5,2,3,7,3,2,3,3,3,3,3,3,3,5,9,10,6,4,7,2,3,1,5,8,1,1,"Based on the facts, it seems this company has declined in all areas within the last year, with Sales dropping by two million, a significant rise in Call center complaints, a significant rise in unresolved complaints, as well as an increase in Service personnel turnover. It could be a problem at the top that needs to be addressed, along with getting to the root of the problem.",9,27,Distribution & Logistics,247,941,
6/10/2025 13:06,6/10/2025 13:16,100,574,1,6/10/2025 13:16,1,4,4,4,5,5,5,4,5,2,4,3,3,2,3,4,5,5,4,2,4,20,17,12,8,4,5,6,15,16,9,7,13,11,19,18,14,2,1,3,10,4,4,3,4,2,3,4,4,4,4,3,4,3,3,2,3,5,4,4,5,9,16,4,3,11,12,8,10,17,15,2,18,19,6,7,14,13,1,-3,2,4,4,4,2,4,5,6,2,7,4,3,1,5,4,1,4,1,4,1,2,4,4,5,1,9,8,3,2,6,10,5,7,4,5,4,"The company is doing poorly, they are decreasing in their sales. Their complaints are up and less are being resolved. Employee turnover is also increasing drastically. Sounds like the company needs to do something different.",9,13,,221,942,
6/10/2025 13:06,6/10/2025 13:22,100,972,1,6/10/2025 13:22,1,5,5,5,5,5,5,5,5,2,4,3,4,3,3,5,5,5,4,2,5,12,17,3,19,2,9,20,13,8,14,5,6,4,16,10,15,7,11,1,18,4,5,2,4,3,3,1,3,2,4,4,4,2,2,3,2,2,4,4,18,17,14,7,16,1,5,2,12,9,19,3,6,4,11,15,8,13,10,-3,5,4,5,4,5,5,1,6,3,7,4,5,2,1,3,5,1,5,1,4,4,1,5,5,2,7,9,6,5,4,1,3,10,8,5,1,"This company is having management issues that if unresolved, are going to cause serious problems. Sales are down and complaints are up. These complaints aren't being resolved at increasing rates. Service personnel are turning over quickly too. It looks like a company culture issue is a problem here that the Service personnel aren't getting quality support and it's causing employee burnout/turnover.",5,17,,234,943,
6/10/2025 12:51,6/10/2025 13:19,100,1672,1,6/10/2025 13:19,1,4,5,4,4,4,3,4,4,2,4,3,4,2,4,5,5,4,3,2,4,13,17,1,4,2,14,16,18,3,9,8,7,20,5,12,11,10,6,19,15,3,3,3,4,2,3,3,3,3,4,4,4,4,4,3,4,3,4,4,16,12,5,1,6,13,15,3,9,2,18,11,10,19,8,17,14,4,7,-3,4,4,4,4,5,5,2,3,6,4,2,5,1,7,3,4,2,2,2,4,4,3,2,4,10,6,8,2,4,5,9,3,1,7,5,2,They are losing market share due to a deterioration in the quality of their products and services. The employees are being affected by the worsening conditions at the company and they are leaving to go work for better companies. It looks like a death spiral for this company.,9,19,,231,944,
6/10/2025 9:28,6/10/2025 9:34,100,387,1,6/10/2025 9:34,1,4,5,3,4,5,5,5,5,2,3,5,3,1,3,5,5,5,5,2,5,10,20,19,6,2,13,4,5,11,12,18,9,3,1,17,16,8,7,14,15,3,3,1,5,4,1,1,2,1,3,5,5,1,3,1,3,5,3,3,17,10,5,1,15,6,11,16,19,3,13,7,8,18,12,14,4,9,2,-3,3,3,3,3,5,3,3,1,7,3,2,5,4,6,3,4,1,3,1,5,3,1,5,5,7,4,9,5,10,1,8,6,2,3,3,2,"Sales are down, complaints have increased significantly and have been increasingly unresolved.  Customer service turnover is also much higher than the previous year.",4,20,,212,945,
6/10/2025 13:50,6/10/2025 13:56,100,379,1,6/10/2025 13:56,1,3,4,3,4,4,4,4,3,2,3,3,4,2,3,4,4,4,4,2,4,16,20,14,8,12,4,15,17,5,11,6,1,9,7,18,10,19,2,13,3,4,3,2,3,2,2,3,3,3,3,4,4,3,2,3,2,4,3,4,7,10,17,11,13,1,2,6,16,12,15,4,5,14,19,3,8,9,18,-3,4,4,3,4,4,4,2,2,4,6,3,1,7,5,3,3,2,4,2,3,3,3,3,5,7,9,4,3,8,6,5,1,2,10,4,2,The company is undergoing a downturn in that personnel turnover is high as well as customer complaints and sales overall have decreased by twenty percent.  They need to define what the problems is in their products and address that otherwise the company will continue to lose money. ,5,19,,211,946,
6/10/2025 17:26,6/10/2025 17:43,100,1044,1,6/10/2025 17:43,1,4,5,3,4,3,3,5,5,2,3,3,4,2,5,4,4,4,5,1,5,12,8,2,16,5,13,6,14,19,18,20,4,17,9,3,15,10,1,7,11,4,4,3,5,1,1,2,4,5,5,4,5,4,5,3,4,4,5,3,8,5,4,9,10,7,16,17,2,18,1,19,13,14,3,15,12,11,6,-3,3,3,3,3,3,3,3,7,6,4,1,5,2,3,3,3,3,3,3,3,3,3,3,5,5,7,8,10,4,3,6,1,2,9,4,4,"This company had an overall worse year in 2023 than 2022. Sales have declined, complaints have gone up by 50% and unresolved complaints have increased by over 100%. Personnel turn-over has also increased. This company needs to improve consumer relations and increase sales. Hiring a consulting firm or a change in management might help.",1,27,primarily service,234,947,
6/10/2025 18:13,6/10/2025 18:20,100,423,1,6/10/2025 18:20,1,4,5,4,5,4,5,4,4,2,4,2,4,1,2,4,4,4,4,1,4,2,13,11,1,17,4,12,19,5,16,20,9,10,14,7,3,15,6,18,8,4,3,5,4,2,2,4,4,4,2,4,4,4,2,2,2,5,4,3,1,13,5,4,9,15,8,19,11,14,10,3,16,12,2,17,6,7,18,3,5,2,5,4,5,4,2,3,1,5,2,4,7,6,4,5,4,4,2,4,4,2,4,5,9,7,2,5,3,8,4,6,10,1,4,2,Sales dropped in 2023 by $2M and complaints increased in 2023 by 50K.Something is not right with this companies products and possibly their marketing.,6,14,,230,948,
6/10/2025 10:52,6/10/2025 11:05,100,818,1,6/10/2025 11:05,1,4,4,3,4,4,3,4,4,2,3,3,2,3,3,3,4,4,3,4,4,5,12,4,15,16,18,19,13,2,17,9,6,14,8,3,11,20,10,1,7,3,3,2,4,2,2,3,3,4,3,4,4,3,3,3,3,4,4,4,11,6,4,8,12,5,19,9,7,1,10,3,13,18,2,17,15,16,14,-3,5,4,5,5,3,5,2,6,7,1,4,2,3,5,4,4,3,3,2,3,4,1,4,5,4,5,3,9,6,8,10,2,7,1,4,2,"We are producing an inferior product and word is getting out to the public about it.  Customer service complaints have increased 50 percent and the problems with our products are not being resolved.  We are also losing work people and that could be a big reason why are products are suffering.  In other words, we need happier personnel or our sales will suffer. ",2,22,,215,949,
6/10/2025 11:08,6/10/2025 11:19,100,697,1,6/10/2025 11:19,1,4,3,4,4,4,3,4,4,2,4,5,5,1,3,4,3,4,5,4,4,6,16,17,14,18,10,13,15,1,9,7,19,12,8,4,3,2,20,11,5,4,4,4,4,2,4,4,4,4,4,3,5,3,3,2,3,4,4,4,13,15,6,8,17,4,19,2,16,1,11,10,12,7,18,3,5,14,9,-3,4,5,5,4,4,4,1,1,3,7,6,5,2,4,4,4,2,4,2,4,4,1,4,5,2,7,9,3,4,5,6,8,10,1,4,1,"The company sales have dropped $2 million in the calendar year. When reviewing the outstanding issues, it looks like the call center complaints have increased by 50,000 on top of that, complaints have not resolved by over 25% from the previous year. The service personnel turnover is unbelievably bad. Every factor showing here is negative, and that is clearly displayed in the sales numbers. The company is going on a horribly downward trend.",5,21,,237,950,
6/16/2025 3:03,6/16/2025 3:23,100,1173,1,6/16/2025 3:23,1,2,3,4,3,4,2,3,4,2,2,1,3,4,2,4,4,4,4,2,2,20,15,16,12,17,5,18,19,10,2,8,6,9,1,14,13,4,11,3,7,4,3,3,4,3,2,2,4,3,4,2,5,5,3,2,4,2,4,4,10,17,13,11,12,14,2,1,9,6,19,15,16,7,3,8,4,5,18,"""-3""",2,4,3,3,5,5,2,6,3,7,2,5,1,4,3,5,1,5,1,5,4,1,5,5,1,2,7,6,5,8,9,10,4,3,3,1,I think there are multiple issues... 1st something is wrong or different with the company personal or the product... Then it looks like chain reaction. No one wants to work for a company that has bad products or people. so if the service personnel keeps overturning then the lack of experience would be an issue with would lead to the customer complaints not being resolved as much as before.. Sorry if I cant explain it very well. It's all an issue and related. I think ,1,27,Personal Services ,213,951,
6/10/2025 12:19,6/10/2025 12:44,100,1516,1,6/10/2025 12:44,1,4,5,4,4,5,4,4,5,2,3,4,3,4,3,5,4,4,5,2,5,11,15,4,18,14,6,2,20,17,1,16,7,9,10,12,8,5,3,19,13,5,5,3,4,4,3,2,4,3,3,4,2,4,3,4,3,3,5,4,5,10,8,4,14,1,2,6,12,16,7,15,9,3,17,19,13,18,11,-3,5,4,4,4,2,4,1,3,4,7,5,1,2,6,5,5,2,4,2,4,5,3,5,5,2,9,10,8,7,3,6,4,1,5,4,2,"The company sales are down since 2022. The companies complaints also have increased since last year. The complaints aren't being resolved as well as last year either. Seems the company is losing workers and hiring new ones. The new ones, may not know the company data and this is causing them to lose sales and bringing in more complaints. The new hires not knowing these analytical data is what seems to be the problem here. The company may not be showing this and in turn are getting these results.",9,19,,238,952,
6/10/2025 11:17,6/10/2025 11:33,100,933,1,6/10/2025 11:33,1,1,3,2,1,1,4,4,3,2,1,1,1,5,3,3,3,4,1,5,4,5,11,4,1,2,20,6,13,9,16,10,17,7,19,14,12,8,15,18,3,3,2,3,3,3,3,4,3,3,4,4,4,3,3,4,3,4,3,3,14,10,8,13,17,9,15,19,5,18,1,3,11,4,6,12,16,2,7,-3,4,3,4,4,4,5,1,1,2,4,5,3,6,7,3,3,3,3,3,3,4,3,3,5,6,7,5,2,4,3,8,1,9,10,5,2,"Something catastrophic is happening within this company. A ""house cleaning"" needs to take place in upper management and consultants should be called in to pinpoint exactly where the problem is. Numbers like the ones above are a road to bankruptcy.",9,15,,188,953,
6/11/2025 12:52,6/11/2025 12:58,100,346,1,6/11/2025 12:58,1,4,4,4,4,4,4,4,2,2,4,4,2,4,2,4,4,4,4,2,4,18,6,20,11,13,2,19,12,17,15,5,1,3,4,9,14,10,8,16,7,4,4,4,2,2,2,4,4,4,2,2,4,4,2,2,2,2,2,4,5,13,8,10,16,2,15,4,11,14,18,19,1,9,3,6,17,12,7,-3,5,4,4,4,2,2,3,4,7,1,5,3,6,2,3,4,4,3,4,3,4,4,4,3,7,9,2,8,6,3,1,10,5,4,5,1,"This company is starting to experience  some issues. Sales have decreased, there are more complaints than the year before, and there is more staff turnover. The company can use this data to make changes to get the company back to where it was before in the year prior. ",4,19,,209,954,
6/10/2025 12:04,6/10/2025 12:15,100,692,1,6/10/2025 12:15,1,3,5,3,2,3,5,5,5,2,4,5,2,5,3,5,5,5,4,5,4,14,8,4,11,15,12,1,5,10,19,17,7,16,9,6,13,20,18,3,2,5,3,2,3,2,2,3,5,4,3,4,5,4,3,2,3,3,2,5,6,15,12,10,17,13,1,8,3,19,5,9,4,16,14,11,7,18,2,-3,3,5,5,5,5,5,3,1,2,5,7,6,4,3,2,5,4,4,2,5,5,3,3,5,7,1,5,8,9,10,2,4,3,6,5,2,"Within a year sales have dropped by 2M dollars, Call Center has received 50k more complaints than in 2022 and in that 25% more complaints have not been resolved.  15% more of the the companies Service personnel have turned over.",2,19,,226,955,
6/10/2025 12:34,6/10/2025 12:43,100,557,1,6/10/2025 12:43,1,3,4,4,3,4,5,4,5,2,2,2,2,4,3,4,3,4,4,3,5,8,2,19,1,17,12,7,18,5,4,9,11,13,3,10,15,6,16,20,14,5,4,3,5,1,2,5,4,4,4,5,5,3,3,3,2,3,3,4,12,13,3,5,8,10,2,15,1,7,18,19,9,11,17,6,4,16,14,-3,5,4,4,4,4,3,4,1,4,3,6,5,7,2,4,3,4,2,4,3,2,3,3,5,3,7,6,10,2,8,5,9,4,1,5,1,"Customer satisfaction is down, thus lowering sales. Complaints are up, personnel are leaving. This could be due to product flaws. Customers complain and personnel get tired of dealing with it.",5,27,Insurance,223,958,
6/12/2025 14:12,6/12/2025 14:16,100,246,1,6/12/2025 14:16,1,1,2,5,2,3,1,3,3,2,4,3,3,3,5,2,5,4,3,5,4,18,3,7,5,16,13,19,6,8,10,14,9,1,11,15,17,20,12,4,2,2,1,2,4,4,3,1,2,5,5,3,2,4,1,1,2,5,4,3,7,8,18,17,12,10,14,16,9,15,13,3,2,1,19,11,5,6,4,-3,5,2,1,4,3,4,2,3,2,5,1,4,7,6,1,2,3,3,1,4,2,5,5,5,6,8,2,7,1,10,3,4,9,5,2,3,their sales is reducing as a result of loss of customers from complaints filed,4,16,,186,959,
6/10/2025 10:47,6/10/2025 11:03,100,986,1,6/10/2025 11:03,1,3,4,3,3,4,4,4,5,2,4,3,4,3,3,4,3,4,5,3,4,9,6,15,16,4,11,8,3,2,14,13,17,5,19,7,20,10,1,18,12,4,3,5,3,4,4,4,4,4,3,4,3,3,3,3,3,4,4,3,15,19,4,11,18,13,2,3,5,7,1,16,14,9,12,8,10,6,17,-3,2,3,3,2,3,3,3,5,7,2,3,1,4,6,4,4,3,4,3,3,3,3,3,5,2,1,6,7,10,3,5,9,4,8,1,1,"Sales have declined by 2 million in 2023, accompanied by a rise in complaints to the call center. Many of these issues remain unresolved, leading to an increase in employee turnover.",9,26,,218,961,
6/12/2025 10:00,6/12/2025 10:15,100,896,1,6/12/2025 10:15,1,2,4,2,2,4,2,4,4,2,2,1,2,2,2,2,4,2,2,5,4,6,2,5,18,9,3,14,16,12,19,10,4,20,7,13,1,15,11,8,17,4,4,4,5,2,4,4,4,5,4,5,4,4,2,4,3,5,4,4,4,11,3,8,19,5,2,15,12,18,6,16,14,1,17,10,13,9,7,-3,4,2,5,5,5,5,2,6,4,1,2,7,3,5,5,5,2,5,3,4,5,3,5,5,7,10,9,4,5,2,3,6,8,1,5,2,It looks like sales went down and call center complaints went up. Complaints have not been resolved. I think people are not happy with this product.,7,14,,217,964,
6/10/2025 14:59,6/10/2025 15:06,100,386,1,6/10/2025 15:06,1,1,4,3,5,3,2,5,5,2,3,1,3,2,3,2,4,5,2,1,5,18,17,7,15,2,16,6,9,20,5,1,11,14,4,12,3,13,19,10,8,5,4,3,4,2,2,3,3,5,4,3,5,5,3,3,3,2,3,4,6,1,10,4,16,18,14,11,8,3,17,19,12,9,2,15,5,7,13,-3,3,4,3,3,3,4,3,3,7,2,6,1,5,4,3,3,1,3,2,3,3,3,5,5,2,6,10,4,8,5,7,3,9,1,2,2,"The company is doing a little worse, losing two million in sales and more frequent complaints. Many of the complaints have not been resolved.",3,17,,207,965,
6/10/2025 14:11,6/10/2025 14:25,100,835,1,6/10/2025 14:25,1,5,4,4,4,4,4,5,2,2,3,2,3,1,3,4,5,5,5,1,4,18,14,13,1,9,3,4,15,8,11,10,5,17,6,16,7,12,2,20,19,4,3,2,5,1,2,2,4,5,4,1,5,2,3,2,2,4,4,4,5,9,18,16,14,10,1,15,6,13,2,12,3,4,19,7,11,17,8,-3,5,2,4,2,3,4,1,1,4,2,6,3,7,5,3,5,1,2,1,4,4,2,5,5,5,6,9,10,4,8,2,3,1,7,5,1,"In this company, in 2022 sales are 10million and in 2023, they went down to 8million. Call center complaints in 2022 were at 100k and in 2023, rose to 150k. Complaints not resolved went from 20% to 45%, and in regard to service personnel turnover, rose from 10% to 25%. The data shows a negative turn in quality and efficiency. In every aspect, the company has regressed. It seems to me that a change in management has occurred, since they stopped doing what was working for them in 2022. ",5,20,,229,966,
6/10/2025 15:26,6/10/2025 16:06,100,2387,1,6/10/2025 16:06,1,4,3,3,4,5,5,5,5,2,3,4,4,2,4,3,3,5,5,2,5,2,12,15,5,14,3,11,9,19,20,8,7,1,17,4,10,13,6,18,16,5,3,4,4,2,3,3,3,5,5,5,3,1,1,1,1,1,4,4,5,13,4,17,9,11,3,18,12,1,10,8,14,6,15,7,16,2,19,-3,5,3,5,5,5,5,2,1,5,6,4,3,7,2,2,5,2,4,1,4,4,2,4,5,8,3,1,5,2,9,10,7,6,4,5,4,"The company in 2022 started out very strong. Within only one year, the company already lost $2M in sales, which seems like a lot to me. Something is going on with the customer service side of the business with more than double the complaints by customers not having issues resolved. As a result of these issues, service personnel turnover is also more than double from the year before. This company needs to take a very hard look at these issues and do something quick, if they want to continue.",9,27,AI data analysis and transcription on the side.,241,967,
6/11/2025 11:08,6/11/2025 11:27,100,1129,1,6/11/2025 11:27,1,4,5,2,3,5,3,4,5,2,4,2,4,2,3,4,5,4,5,3,4,20,9,13,1,19,12,2,7,3,10,18,4,17,14,11,15,8,6,5,16,4,3,4,4,2,3,3,4,4,4,2,5,5,4,4,5,5,5,4,19,4,2,1,10,12,14,5,11,13,15,9,8,7,16,3,18,6,17,-3,5,3,5,5,4,5,2,1,6,3,4,2,5,7,3,5,2,5,2,5,5,2,5,5,10,4,9,3,2,6,1,8,7,5,4,2,"I am no expert but it looks like from 2022 to 2023 this company is on the decline based on the fact that they have reduced sales, more complaints not resolved as well as a higher personnel turn-over.",9,26,,257,968,
6/11/2025 11:14,6/11/2025 11:20,100,398,1,6/11/2025 11:20,1,4,4,4,3,4,4,3,3,2,4,3,4,2,2,4,4,3,3,2,3,17,15,19,7,11,13,4,6,8,20,18,3,16,12,14,5,1,10,2,9,4,4,3,4,3,3,3,4,4,4,2,4,4,2,2,2,4,2,3,9,16,18,3,5,10,14,4,13,6,19,11,2,12,17,8,1,7,15,-3,5,4,4,4,4,4,2,5,3,6,7,4,2,1,3,4,3,4,2,3,3,3,4,5,3,2,5,1,6,8,9,10,7,4,4,4,Internal issues within the company.  There could be a problem with the product but the company is having issues in their CS department (or they have downsized) and I would assume an unhappy workforce/environment based on the turnover rate.,4,18,,219,969,
6/10/2025 13:25,6/10/2025 13:51,100,1556,1,6/10/2025 13:51,1,5,5,5,5,5,5,5,5,2,5,5,5,1,5,5,5,5,5,1,5,9,11,10,6,1,20,14,7,4,18,8,17,13,2,15,12,3,19,16,5,5,5,1,5,5,5,5,5,1,4,4,5,5,5,5,5,5,5,5,13,5,19,14,16,10,15,8,1,2,12,11,3,9,7,6,18,4,17,-3,5,5,5,5,5,5,5,3,1,6,4,5,7,2,1,4,1,5,1,5,5,1,5,5,7,4,6,8,5,1,9,10,3,2,5,1,"Sales been decline , More customers complaints means low quality service or product. Unsolved complaints means the employees are not motivated to perform their jobs.And finally is been a huge increase in personal turn-over . Looks like a lack of leadership from Management . When Management lacks to be supporting to the employees they usually lost motivation to perform . Management needs to be improve and support the team. They need to spend more time working with the employees and show support .",3,20,,265,970,
6/10/2025 9:56,6/10/2025 10:06,100,590,1,6/10/2025 10:06,1,4,4,3,4,5,5,5,5,2,3,4,3,3,4,4,4,4,5,2,5,16,2,6,9,4,12,10,15,7,11,8,5,14,20,18,1,13,3,19,17,5,4,3,5,3,3,4,3,4,4,5,4,2,4,4,4,4,5,4,11,8,13,9,19,7,12,16,4,14,5,1,10,2,18,15,17,3,6,-3,4,3,4,3,5,2,4,5,2,3,1,6,7,4,3,4,3,3,3,4,2,3,2,5,2,5,10,8,4,3,1,7,6,9,5,1,"Sales are decreasing and customers are unhappy. There are problems with the product or service and the team is unable to deal with the issues, so people on the front end, who take the brunt of abuse/complaints are leaving. This is causing further customer service issues, and a spiral of problems that will only increase.",6,13,,222,971,
6/10/2025 20:56,6/10/2025 21:08,100,745,1,6/10/2025 21:08,1,4,4,4,5,4,3,3,5,2,4,4,4,1,5,5,5,4,4,1,5,17,14,2,7,3,20,13,9,16,15,11,18,19,6,8,4,12,1,5,10,4,4,4,3,2,3,4,4,4,5,1,4,5,5,4,5,5,5,5,17,4,15,14,7,18,6,2,16,10,19,5,9,3,13,11,8,1,12,-3,5,4,4,5,5,5,1,6,3,4,2,5,7,1,3,5,2,3,1,5,4,2,3,5,5,4,6,8,2,9,1,7,3,10,5,4,"I lost the data before I tried to answer, so this answer is meaningless. Sorry.",3,21,,261,972,
