StartDate,EndDate,Progress,Duration (in seconds),Finished,RecordedDate,Informed Consent,Q20_1,Q20_2,Q20_3,Q20_4,Q20_5,Q20_6,Q20_7,Q20_8,Q20_9,Q20_10,Q20_11,Q20_12,Q20_13,Q20_14,Q20_15,Q20_16,Q20_17,Q20_18,Q20_19,Q20_20,Q20_DO_1,Q20_DO_2,Q20_DO_3,Q20_DO_4,Q20_DO_5,Q20_DO_6,Q20_DO_7,Q20_DO_8,Q20_DO_9,Q20_DO_10,Q20_DO_11,Q20_DO_12,Q20_DO_13,Q20_DO_14,Q20_DO_15,Q20_DO_16,Q20_DO_17,Q20_DO_18,Q20_DO_19,Q20_DO_20,Q1_1,Q1_2,Q1_3,Q1_4,Q1_5,Q1_6,Q1_7,Q1_8,Q1_9,Q1_10,Q1_11,Q1_12,Q1_13,Q1_14,Q1_15,Q1_16,Q1_17,Q1_18,Q1_19,Q1_DO_1,Q1_DO_2,Q1_DO_3,Q1_DO_4,Q1_DO_5,Q1_DO_6,Q1_DO_7,Q1_DO_8,Q1_DO_9,Q1_DO_10,Q1_DO_11,Q1_DO_12,Q1_DO_13,Q1_DO_14,Q1_DO_15,Q1_DO_16,Q1_DO_17,Q1_DO_18,Q1_DO_19,Q32,Q22_1,Q22_2,Q22_3,Q22_4,Q22_5,Q22_6,Q22_7,Q22_DO_1,Q22_DO_2,Q22_DO_3,Q22_DO_4,Q22_DO_5,Q22_DO_6,Q22_DO_7,Q21_1,Q21_2,Q21_3,Q21_4,Q21_5,Q21_6,Q21_7,Q21_8,Q21_9,Q21_10,Q21_DO_1,Q21_DO_2,Q21_DO_3,Q21_DO_4,Q21_DO_5,Q21_DO_6,Q21_DO_7,Q21_DO_8,Q21_DO_9,Q21_DO_10,Q24,Q33,Q34,Q29,Q28,Q28_27_TEXT,SC0,TWIN_ID,
6/10/2025 8:47,6/10/2025 8:53,100,322,1,6/10/2025 8:53,1,4,4,4,4,4,4,3,4,2,4,3,3,1,4,4,4,4,4,1,4,13,14,19,15,6,5,7,12,3,17,1,10,9,8,4,11,20,18,2,16,5,4,3,3,3,2,3,3,4,3,3,4,4,3,2,3,3,4,4,15,16,8,10,9,17,4,1,3,13,18,2,7,14,11,12,19,6,5,-3,4,4,4,4,4,4,2,2,3,4,5,6,7,1,4,4,2,3,3,3,4,3,4,5,5,7,2,10,9,8,4,3,1,6,1,1,"They may have launched something new on the market that wasn't received well by it's customers.  Or they just started receiving revenue for the first thing they've ever brought to market.  Whatever they released, made customers unhappy and has made their sales decline.  ",1,1,,208,1396,
6/10/2025 13:55,6/10/2025 14:03,100,475,1,6/10/2025 14:03,1,2,4,2,2,2,4,4,2,2,2,2,2,4,2,4,4,2,4,4,4,8,2,12,7,9,16,3,13,11,19,20,18,4,15,5,10,14,6,17,1,5,3,4,4,1,4,4,5,5,2,4,4,4,2,2,3,2,2,3,7,16,14,11,4,8,17,13,3,10,6,12,18,9,5,1,2,19,15,-3,4,4,5,4,4,4,4,1,3,7,6,4,5,2,4,3,5,2,4,1,2,5,2,5,7,8,10,3,1,9,2,6,5,4,4,2,"Sales are down, complaints are up, complaints are not being solved, turnover is high. ",9,1,,193,1397,
6/10/2025 10:29,6/10/2025 10:43,100,836,1,6/10/2025 10:43,1,4,5,4,4,5,5,5,5,2,4,2,3,2,4,5,5,4,4,2,4,14,11,8,15,5,2,19,17,6,3,13,7,20,12,4,9,10,1,18,16,4,4,3,2,2,2,2,4,4,3,4,4,4,3,2,2,2,4,5,13,19,6,17,3,18,15,2,12,8,10,7,1,16,14,4,9,5,11,-3,4,4,4,3,4,4,2,5,4,2,3,7,1,6,4,5,1,4,1,5,4,2,4,5,7,8,2,4,9,5,6,1,3,10,5,1,"This company sales have decreased.
Also, complaints have risen, and personnel turn-over has increased. ",7,27,Business Services,240,1399,
6/13/2025 15:04,6/13/2025 15:11,100,392,1,6/13/2025 15:11,1,2,3,2,3,4,4,2,3,2,2,3,3,4,3,4,3,2,4,4,4,16,4,6,12,20,18,9,10,14,2,1,8,17,19,15,13,3,11,7,5,5,4,4,4,4,3,4,4,5,4,2,5,4,3,3,4,4,4,3,18,7,11,2,17,19,5,12,8,16,1,9,10,6,4,15,3,14,13,-3,4,4,4,3,4,4,3,7,5,3,1,4,2,6,3,5,5,3,4,5,2,3,4,5,5,1,8,10,6,2,3,9,7,4,1,1,the sales have decreased while the complaints have increased.,5,19,,211,1400,
6/10/2025 10:31,6/10/2025 10:41,100,610,1,6/10/2025 10:41,1,4,3,3,3,4,5,5,5,2,3,3,4,5,4,3,5,5,5,3,5,1,13,16,14,6,19,4,3,5,20,11,10,12,2,8,17,18,15,7,9,5,3,5,5,4,4,5,5,5,4,5,4,5,3,3,3,5,4,4,2,4,13,10,16,7,19,1,9,14,18,15,3,12,17,6,5,8,11,-3,3,4,2,4,2,1,3,6,5,1,3,4,7,2,4,2,4,5,5,2,4,4,5,5,8,10,7,6,1,3,5,2,4,9,1,1,The service personnel are slacking causing many call center complaints. Due to the lack of service personnel many complaints go unresolved causing a major dip in sales.,2,27,Food service,228,1401,
6/10/2025 16:58,6/10/2025 17:11,100,750,1,6/10/2025 17:11,1,3,4,4,4,3,4,4,3,2,3,4,4,1,5,5,5,2,3,2,2,18,20,17,10,5,7,6,2,9,15,14,8,4,12,3,19,1,11,16,13,3,3,4,4,1,2,4,3,1,4,3,4,4,4,3,4,4,3,4,7,10,19,14,5,2,18,16,4,12,17,8,6,3,9,1,11,13,15,-3,3,3,3,3,3,3,3,7,1,3,4,2,5,6,3,3,3,3,3,3,3,3,3,5,10,3,2,9,8,7,1,6,5,4,1,2,"The company is not facing its problems.  Sales are down and the reason is that there is a problem with its product, indicated by the increase in complaints.  But the company is not dealing with the issue, indicated by the increase in unresolved complaints.  That issue is leading to employee problems, indicted by the turnover.  I expect that the personnel turnover problem is not limited to the Service Department.  The root of the company's problem is in upper management. ",1,27,retired,215,1402,
6/11/2025 17:16,6/11/2025 17:39,100,1387,1,6/11/2025 17:39,1,5,5,4,4,5,5,3,4,2,4,3,5,1,3,5,4,4,5,1,5,9,16,13,7,12,19,10,1,5,4,3,8,14,18,20,11,2,15,17,6,5,4,3,5,1,2,3,4,5,4,3,4,3,3,2,3,4,5,3,7,14,3,18,12,6,9,1,17,16,5,2,15,4,8,11,19,13,10,-3,4,5,5,5,4,5,1,6,3,1,4,5,2,7,3,4,3,4,2,4,4,1,5,5,4,7,9,5,1,2,8,10,6,3,1,1,"This company likely had some sort of service failure, because that data shows there is an increase of call center complaints and also increased complaints not resolved. I am unsure if this is causing the service personnel turnover but due to pressure to perform under harsh conditions, this may be the case. This failure has also caused an expected reduction in sales.",9,1,,237,1403,
6/10/2025 18:41,6/10/2025 18:54,100,744,1,6/10/2025 18:54,1,4,4,4,4,5,3,4,4,2,4,2,4,2,4,4,5,4,4,2,5,6,9,19,5,4,14,3,13,10,11,7,2,15,1,12,18,17,16,20,8,4,3,5,4,2,3,2,4,5,5,3,4,4,3,3,3,5,5,5,7,14,9,10,13,16,5,18,19,1,2,17,8,12,4,3,11,15,6,-3,4,3,4,3,4,5,2,4,6,2,3,1,7,5,4,5,2,4,3,5,3,2,4,5,1,3,10,6,5,9,8,7,4,2,4,4,"In each of these measurable metrics, this company's performance has decreased over time. They are making less money, getting more complaints, those complaints are not being addressed as well, etc. I'd assume there's something wrong with management, perhaps the company is going through some kind of controversy, or their product is not working very well.",1,25,,242,1404,
6/10/2025 17:24,6/10/2025 17:33,100,539,1,6/10/2025 17:33,1,5,5,5,4,5,4,4,5,2,5,4,4,1,4,5,5,4,5,2,5,9,10,20,6,5,2,13,8,1,17,4,11,15,3,14,7,16,19,12,18,4,5,3,4,2,2,4,4,4,4,3,5,4,4,5,4,4,4,5,17,4,9,2,14,6,1,13,11,10,12,15,8,19,5,18,3,7,16,-3,5,3,5,5,5,5,2,5,1,6,7,4,3,2,3,5,2,5,2,4,5,2,5,5,6,3,7,4,9,2,10,1,5,8,4,1,"It appears that in addition to sales turning down, there are substantially more complaints from customers.  And many more complaints unresolved.  Employees also seem more unhappy at the company and customers are dwindling.",6,12,,252,1405,
6/10/2025 11:35,6/10/2025 11:57,100,1338,1,6/10/2025 11:57,1,5,5,4,5,5,3,4,5,2,5,5,4,1,3,5,5,4,5,1,5,4,3,8,15,7,9,1,2,20,10,11,18,14,19,6,13,16,17,5,12,5,5,3,5,2,1,1,4,4,5,3,5,5,4,4,4,5,5,5,19,12,3,6,2,16,17,5,4,14,13,9,1,8,10,15,18,11,7,-3,5,4,4,4,5,5,1,3,7,1,2,6,4,5,4,5,3,5,2,4,5,2,5,5,10,5,1,4,7,9,2,6,3,8,1,1,"There appears to have been significant growth in all sectors except Sales. However, it also appears that the number of unresolved complaints has doubled, and overall complaints are up by 50%. The sales dropped by $2 million, and nearly three times as many people quit the workplace. ",4,25,,263,1407,
6/10/2025 14:29,6/10/2025 14:38,100,579,1,6/10/2025 14:38,1,5,5,4,5,5,5,5,4,2,5,5,5,1,5,5,5,5,4,1,4,11,14,20,8,15,9,10,18,13,17,19,5,7,6,16,1,4,3,2,12,4,1,1,4,3,1,2,4,3,4,4,2,2,5,1,5,4,5,1,11,9,1,10,17,15,19,16,18,14,4,5,12,6,7,13,2,8,3,-3,2,4,2,2,5,3,4,3,2,4,6,1,7,5,2,2,1,1,2,1,4,1,4,5,6,5,4,7,9,10,8,1,2,3,2,1,"In short, the company is struggling. Their sales figures have dropped 20% YoY. Further, they have received 50% more complaints in 2023 and the complaints that didn't get resolved have more than doubled. Lastly, the company has lost 150% of their workforce due to turnover. In my estimation, there is an issue with the product(s) they are selling which is leading to customers getting upset. They are having a hard time pleasing the customers because they are also understaffed.",9,13,,208,1408,
6/10/2025 13:24,6/10/2025 13:31,100,417,1,6/10/2025 13:31,1,2,5,3,2,3,3,4,3,2,1,3,3,3,3,3,4,3,4,3,5,15,10,7,11,3,20,13,19,9,17,16,2,12,14,4,6,18,5,1,8,3,1,3,3,2,3,3,3,4,4,4,3,4,2,4,2,4,3,3,12,9,6,7,19,1,11,13,5,2,3,18,10,16,15,4,8,17,14,-3,4,4,4,3,4,4,1,3,6,1,7,2,5,4,4,5,1,5,3,4,3,2,3,5,3,5,7,6,4,2,9,10,8,1,5,4,This company seems to be declining in every way possible at this current rate. The sales are down 2 million dollars from the previous year and also the complaints have over 50 thousand more than the previous year. Also the complaints are being solved at a worse rate than before. ,3,13,,200,1410,
6/10/2025 10:31,6/10/2025 10:39,100,473,1,6/10/2025 10:39,1,3,3,2,4,4,4,3,3,2,4,2,2,4,2,3,3,3,3,2,4,13,17,16,9,1,3,8,5,11,2,10,12,15,14,20,18,4,19,6,7,5,4,4,3,1,4,5,4,5,4,3,5,4,4,5,3,4,4,4,8,16,7,6,19,2,3,17,5,11,13,15,4,1,9,14,10,12,18,-3,4,3,4,4,4,4,2,2,5,4,1,3,6,7,3,4,4,4,3,4,4,2,4,4,10,5,9,6,1,8,2,3,4,7,2,1,"It's obvious this company has a problem.  More complaints that have not been resolved would lead to frustration and people not using this company.  The overturn in workers is not a good sign.  They need to have a training program for new employees to understand what they are there for, then concentrate on the complaints and resolve more.  The sales reflect what a bad job they are doing when people have problems with their products.  They need internal training immediately to reverse this trend. ",4,19,,220,1411,
6/10/2025 14:07,6/10/2025 14:18,100,636,1,6/10/2025 14:18,1,3,5,3,3,3,3,3,3,2,3,4,3,3,4,5,4,4,5,2,5,14,20,3,19,10,6,8,11,9,5,2,12,16,18,7,4,1,13,17,15,4,4,2,5,3,3,3,4,3,3,4,4,3,3,2,4,2,3,3,19,10,2,1,12,14,5,15,11,4,8,9,18,13,16,7,6,3,17,-3,3,3,5,4,2,2,5,4,5,2,3,6,7,1,3,3,3,2,4,3,2,3,2,5,7,2,9,6,1,5,10,8,3,4,5,1,"The problem is likely systemic since there is a sizeable difference in just one year. Sales are down, complaints have increased while resolution has decreased, and turnover has increased considerably. I would say it's probably something going on at the top that is causing a problem for everyone, kind of like a ripple.",7,21,,206,1412,
6/10/2025 12:00,6/10/2025 12:11,100,672,1,6/10/2025 12:11,1,4,4,4,4,4,4,3,4,2,4,4,3,2,5,5,5,5,4,1,4,6,7,14,20,2,13,19,15,11,18,3,10,17,1,4,5,12,9,8,16,4,4,5,4,2,1,2,4,3,3,2,5,4,3,3,2,5,3,5,8,9,1,12,6,10,4,16,13,5,19,7,14,17,2,11,18,3,15,-3,3,4,4,4,5,4,1,5,3,7,2,4,1,6,3,4,2,4,2,3,3,2,3,5,4,5,7,1,6,10,9,2,3,8,5,1,The company is selling an unintuitive product and developing a reputation of poor customer service which is harming sales.,4,21,,234,1413,
6/19/2025 20:28,6/19/2025 20:38,100,635,1,6/19/2025 20:38,1,2,3,3,3,3,3,4,2,2,3,2,3,2,2,3,4,3,2,3,4,13,9,16,10,2,6,3,18,17,12,11,8,4,14,5,15,20,19,1,7,3,3,4,4,2,3,4,3,4,2,4,4,4,3,3,3,4,4,3,1,17,19,8,14,9,18,10,15,2,3,11,16,6,5,12,13,4,7,-3,3,3,3,4,4,4,2,6,7,2,4,3,5,1,4,4,2,4,2,3,4,2,4,5,8,5,9,1,4,7,3,6,10,2,5,4,"As sales are lower from 2022 to 2023, the complaints have risen to well over half. The complaints that are not resolved have increased to double in 2023. And personnel turnover has over doubled in 2023. It looks like there is a morale problem, problems with the product or service where sales are going down and complaints are going up. The company is heading towards trouble sustaining or maintaining if it does not resolve these problems.",2,12,,198,1414,
6/10/2025 17:49,6/10/2025 18:14,100,1487,1,6/10/2025 18:14,1,5,3,4,5,4,3,4,5,2,5,3,3,5,5,4,5,5,5,1,4,7,18,15,4,1,19,11,20,13,6,14,8,9,5,17,3,2,12,10,16,3,5,3,4,2,2,2,4,4,5,1,4,5,3,2,4,5,5,5,8,17,19,4,18,5,9,15,10,2,3,11,12,13,7,16,14,6,1,-3,5,5,5,5,5,5,1,3,7,6,1,2,5,4,3,3,2,4,1,4,4,4,4,5,10,5,1,9,8,3,2,7,6,4,1,4,I looks like that the company is struggling to address customer complaints which led to a decrease in sales the following year and an increased demand from customers to fix issues that the company cannot figure out how to fix ,4,20,,248,1415,
6/13/2025 0:44,6/13/2025 0:49,100,288,1,6/13/2025 0:49,1,5,3,5,4,5,3,4,5,2,3,5,3,1,5,5,5,3,3,1,4,8,11,17,3,13,4,12,16,2,20,10,7,14,19,9,18,1,5,15,6,5,5,5,5,1,3,1,5,5,5,3,5,5,5,5,5,4,5,5,7,13,19,18,1,8,2,11,17,16,15,5,6,3,10,4,9,14,12,-3,1,1,1,1,2,1,1,4,5,1,2,3,6,7,1,1,1,1,1,3,1,1,5,5,6,2,5,3,8,1,7,4,10,9,3,1,Customer service is leading to reduced sales and it is leading to people leaving,4,19,,223,1416,
6/13/2025 10:20,6/13/2025 10:27,100,388,1,6/13/2025 10:27,1,3,4,5,3,4,4,5,5,2,3,1,2,2,3,5,5,4,2,2,4,20,10,17,14,4,6,8,16,15,7,3,19,18,2,9,5,1,11,12,13,4,5,1,3,5,2,2,1,1,2,1,5,4,2,3,3,4,4,5,13,11,19,10,14,16,1,2,3,8,18,7,12,4,17,9,6,5,15,-3,5,5,5,4,5,5,1,1,2,3,7,6,5,4,4,4,1,5,1,5,5,1,5,5,5,10,2,6,7,9,4,3,8,1,2,2,"The turnover in service personnel is creating a backlog of complaints that are not getting resolved, which in turn is decreasing sales, and probably repeat sales customers, who feel the product/service is not as good or useful as it had been previously.",9,19,,226,1418,
6/10/2025 14:29,6/10/2025 14:40,100,682,1,6/10/2025 14:40,1,4,4,3,4,4,4,4,4,2,4,3,4,2,3,4,4,4,4,2,4,18,11,8,9,1,13,10,14,16,6,15,12,19,4,7,5,2,17,3,20,4,3,3,4,2,2,3,4,3,4,2,4,4,3,3,3,3,4,4,2,18,12,7,8,13,6,10,19,16,4,14,1,17,3,15,9,11,5,-3,2,3,2,3,4,3,2,2,4,1,5,6,3,7,4,4,3,4,2,3,4,2,4,5,4,10,7,8,2,3,1,9,5,6,2,1,"They've hit a rough spot. Their turnover has increased as well as complaints and many of those complaints are not resolved. Their sales are also slumping. Management needs to analyze and search out the root casue of some of these issues. Are increased complaints leading to turnover or is the turnover leading to complaints? Which ever is the issue it needs to be resolved.  Why are sales down? Is is a result of a change in market or has quality declined? Once again, this issue needs attention.",6,27,construction & building,227,1420,
6/10/2025 10:04,6/10/2025 10:21,100,1043,1,6/10/2025 10:21,1,3,5,4,1,4,5,5,5,2,2,2,3,4,2,3,2,4,3,2,5,4,9,6,17,14,8,13,3,18,7,12,15,11,19,5,16,2,1,20,10,4,3,4,3,2,3,2,3,4,3,5,2,4,2,1,3,4,5,4,11,17,6,10,15,13,7,5,14,16,12,9,4,3,8,2,1,18,19,-3,4,3,4,4,4,4,3,7,4,6,5,2,1,3,3,3,4,3,4,3,3,3,4,5,9,2,3,7,6,8,4,5,10,1,2,1,"On the surface it appears there is some form of product or service quality drop leading to a drop in sales, 50% increase in CS contacts and a 125% increase in un-resolved complaints. This should be a red flag to review the end product. The odd number is the increase of 150% loss of personnel. On the surface this indicates the satisfaction with the job has had a significant drop due to multiple factors, bad product, mad customer, low morale, and perhaps lack of good judgement from leadership.",9,21,,208,1421,
6/10/2025 14:23,6/10/2025 14:29,100,347,1,6/10/2025 14:29,1,4,4,4,4,3,4,4,4,2,3,3,3,1,3,3,5,3,4,2,5,12,2,17,18,1,19,3,14,6,7,9,16,10,13,5,4,20,8,15,11,4,2,3,3,4,2,3,3,3,4,4,4,5,3,3,3,5,3,3,9,18,5,10,4,11,12,3,15,17,13,2,14,8,16,7,6,19,1,-3,3,2,3,3,4,4,3,5,6,3,7,2,4,1,2,4,2,3,2,3,4,2,4,5,3,8,6,7,1,10,2,9,5,4,1,1,The company isn't listening to its employees or treating them well.,9,16,,207,1422,
6/16/2025 8:11,6/16/2025 8:24,100,779,1,6/16/2025 8:24,1,4,5,4,4,3,5,4,4,2,4,4,4,2,4,5,4,4,4,3,4,7,2,13,19,18,12,10,20,8,3,14,9,16,5,4,1,11,6,15,17,3,4,2,4,4,2,4,2,1,4,4,3,4,2,2,3,4,4,4,12,9,16,19,14,5,10,2,17,7,13,18,8,15,11,3,4,6,1,-3,4,4,4,4,5,4,2,7,5,1,3,2,4,6,4,4,2,4,3,5,4,4,3,5,4,3,9,5,6,2,10,7,8,1,1,4,"This company is in trouble because it has a high turnover of service personnel, which shows a lack of qualified and experienced labor. This is why the number of customer complaints has multiplied, resulting in a decrease in sales.",4,16,,219,1423,
6/10/2025 12:38,6/10/2025 12:46,100,515,1,6/10/2025 12:46,1,4,4,4,4,4,3,4,5,2,4,4,4,2,4,3,5,3,4,2,5,16,18,19,12,6,14,3,17,9,20,15,13,8,7,11,4,2,1,10,5,4,4,3,4,2,4,4,4,5,5,2,5,5,3,4,4,4,4,5,10,4,8,9,7,13,5,6,1,18,17,16,11,2,14,12,19,15,3,-3,4,3,4,4,5,5,4,3,7,5,4,1,2,6,4,5,4,5,3,5,4,4,4,5,4,3,2,6,9,10,1,8,5,7,5,2,"There are more issues than before with products and the complaints on the products or services is going untouched, and not fixed. This results in less sales overall, and higher stress at the work place, leading to a higher employee turnover.",4,21,,251,1424,
6/10/2025 13:31,6/10/2025 13:44,100,778,1,6/10/2025 13:44,1,3,4,3,2,4,3,3,4,2,3,2,5,2,2,4,4,3,4,2,4,10,14,20,7,4,19,13,2,3,17,6,11,8,9,12,5,18,16,1,15,5,4,3,3,2,3,4,5,4,4,2,5,5,5,4,5,5,5,5,15,5,19,6,9,17,4,3,10,16,8,13,12,7,2,18,1,11,14,-3,3,3,3,3,4,3,2,6,1,3,7,5,2,4,5,5,2,5,2,4,4,2,4,5,7,5,3,8,9,10,2,1,4,6,2,1,"This company's sales are down 20%.  It could be related to the 50% increase in call center complaints, the 25% increase in unresolved complains, and the 15% increase in personnel turnover.  One has to look more deeply into the cause of these contributing factors.",1,27,Design,235,1425,
6/10/2025 13:59,6/10/2025 14:19,100,1201,1,6/10/2025 14:19,1,4,4,2,3,3,4,4,4,2,3,3,3,2,3,3,4,3,3,2,4,1,8,7,3,17,2,4,13,20,15,6,19,9,11,18,10,12,14,5,16,3,3,3,3,2,3,3,3,3,2,4,4,4,2,3,2,5,3,3,16,4,10,8,9,14,12,3,18,11,7,5,17,13,2,6,1,15,19,-3,3,3,3,3,3,3,2,2,3,7,1,5,6,4,2,2,2,2,3,3,3,3,2,5,5,3,8,2,10,9,4,7,1,6,2,4,This company released a bad product and is getting more customer service requests as a result. The current customer service agents are not able to handle the increased load and are quitting due to being overworked. ,3,21,,196,1426,
6/10/2025 8:36,6/10/2025 8:46,100,580,1,6/10/2025 8:46,1,3,5,3,3,5,5,5,4,2,3,3,3,3,3,5,5,5,5,3,4,14,20,17,19,18,13,9,2,1,16,15,11,10,8,5,12,4,7,3,6,3,4,3,5,2,3,3,3,4,3,3,5,3,2,3,2,5,4,3,14,11,2,15,6,12,8,16,17,4,7,13,18,3,5,19,1,10,9,-3,5,3,3,3,2,5,3,4,3,6,5,2,1,7,3,3,3,3,3,4,3,3,3,5,9,3,8,5,7,6,10,4,1,2,5,2,"Sales went down by 2 million in 2023 versus 2022 while call center complaints increased from 100 to 150K during that same time. In addition, the statistics for complaints not resolved jumped from 20% in 2022 to 45% in 2023 while service personnel turnover also significantly increased from 10% to 25%. Overall, the company did much less well in 2023 than in 2022.",5,13,,216,1427,
6/10/2025 11:03,6/10/2025 11:08,100,311,1,6/10/2025 11:08,1,3,3,4,4,4,3,3,4,2,3,4,3,3,3,3,4,3,4,3,5,12,14,18,9,5,16,13,8,15,11,1,6,2,3,10,17,4,20,19,7,5,5,3,4,2,3,4,3,5,5,4,5,3,3,3,4,4,4,4,3,1,13,5,11,6,9,19,14,17,2,10,16,18,7,8,12,4,15,-3,3,3,3,3,3,3,3,2,4,6,5,7,3,1,3,3,3,3,3,3,3,3,3,4,5,7,3,9,2,1,4,6,10,8,5,1,It seems like the sales are declining and they are having an increase in complaints and they are not resolving the complaints. This seems like a company that is about the dollar and they do not care about customers or their employees. ,4,19,,214,1430,
6/10/2025 18:04,6/10/2025 18:11,100,427,1,6/10/2025 18:11,1,3,4,3,4,3,5,5,4,2,2,3,3,4,3,3,4,3,5,2,5,1,15,20,2,4,3,14,17,8,5,18,7,6,16,13,12,10,11,19,9,5,4,3,4,1,3,4,5,5,5,2,4,3,5,5,5,3,4,4,8,2,15,5,13,17,18,4,10,9,3,11,12,19,14,16,7,1,6,-3,4,3,4,4,3,5,2,3,6,2,7,4,5,1,3,4,2,4,3,4,4,3,5,5,8,9,7,4,10,1,3,2,5,6,5,2,"The company's sales decreased by $2 in just a year, while their call center complaints increased. Complaints not being resolved increased as well and the company's turnover rate increased. In my opinion, it seems bad customer service and the work environment is leading to high turnover rate and less sales, along with more complaints.",3,23,,239,1432,
6/10/2025 14:30,6/10/2025 14:56,100,1543,1,6/10/2025 14:56,1,3,4,3,3,4,3,4,3,2,3,3,2,2,3,4,3,4,2,2,3,10,5,19,15,4,3,17,16,14,6,9,12,18,13,8,11,2,1,7,20,3,5,3,4,4,3,2,4,3,2,3,4,4,3,3,3,2,2,3,19,17,4,14,12,10,6,1,9,3,7,16,2,5,13,15,11,18,8,-3,3,3,2,3,2,3,3,7,3,2,1,6,4,5,3,3,3,3,2,4,3,3,3,5,2,5,6,1,9,3,8,10,4,7,4,3,Complaints are constantly rising year to year and sales are are going down drastically. The complaints are not resolved either so the customer service is atrocious.,3,27,construction,204,1433,
6/10/2025 9:16,6/10/2025 9:32,100,953,1,6/10/2025 9:32,1,4,4,4,4,4,4,4,4,2,4,4,4,2,4,4,4,4,4,2,5,17,7,11,20,10,18,3,9,6,14,1,12,13,8,5,16,4,19,15,2,4,4,4,4,4,4,4,4,5,4,2,4,4,4,4,4,4,4,4,10,12,3,14,11,9,7,4,18,5,19,16,15,17,2,8,1,6,13,-3,4,4,4,4,4,4,4,2,4,1,6,5,7,3,4,4,4,4,4,4,4,4,4,5,4,2,10,8,5,7,3,6,9,1,5,1,"The service employees are no happy because of the 15% increase in high turn-over rate, which means they are not being managed well. The customer complaints not resolved increased by 25% because the service employees are not managed well. The call center complaints increased by 50K because the service employees are not being managed properly, which ultimately led to a $2M decrease in sales for this company.",6,12,,235,1434,
6/10/2025 11:36,6/10/2025 11:59,100,1401,1,6/10/2025 11:59,1,4,4,4,3,3,4,4,4,2,4,3,2,4,3,2,3,3,3,4,4,1,10,3,11,20,15,17,18,7,8,14,9,6,12,4,19,13,2,16,5,4,4,4,4,1,4,4,5,4,4,4,4,4,4,4,4,4,4,4,13,11,4,17,15,6,7,2,19,5,14,8,10,3,16,12,18,1,9,-3,4,3,3,4,4,4,4,1,4,7,3,2,5,6,3,2,3,3,3,3,3,4,3,5,9,3,10,8,4,6,2,7,1,5,1,1,"The numbers went down a decent amount from 2022 to 2023.  There seems to be more complaints with things in 2023 and many complaints were not resolved for 2023 as well.  And there was a signigicant service turn over.  So maybe its leadership, the product but 2023 took a hit ",9,26,,223,1435,
6/10/2025 11:02,6/10/2025 11:26,100,1424,1,6/10/2025 11:26,1,3,4,2,3,3,5,5,3,2,2,3,4,1,2,3,4,5,4,4,4,11,5,13,12,3,8,1,20,14,6,2,10,9,7,17,4,15,18,19,16,4,4,3,4,1,3,4,2,4,4,5,4,3,1,4,1,3,3,3,5,16,17,18,11,4,8,19,3,14,9,10,12,7,15,2,13,1,6,-3,2,2,4,2,4,4,4,6,7,5,3,4,1,2,2,2,5,4,4,2,2,4,5,5,7,9,1,2,5,6,4,10,3,8,1,1,"In 2022, the company released a product that underperformed so badly that it resulted in over a hundred thousand complaints over the phone and, more importantly, the targeted number of sales not being met. The following year, the company did not learn from this disaster and as a result, released a product that was even worse with turning in a profit and received more complaints. Most likely, the company cut corners to get the product out faster to make up for last year's net negative profit.",1,23,,199,1436,
6/10/2025 10:17,6/10/2025 10:33,100,992,1,6/10/2025 10:33,1,2,3,2,2,4,4,5,5,2,2,2,3,4,4,2,2,4,4,2,5,8,14,15,5,9,18,10,17,1,13,19,11,16,6,2,20,3,12,4,7,4,3,4,4,2,4,4,3,4,3,4,5,4,4,4,4,4,5,4,3,19,18,13,15,16,11,14,2,10,6,8,7,12,4,9,17,5,1,-3,2,5,5,4,4,3,4,5,7,2,1,6,4,3,4,2,5,1,5,2,1,4,2,5,8,2,6,3,9,4,5,1,10,7,4,2,"The company sales began to decrease in 2023 by $2M. Anytime sales decrease, it means something negative is going on in the company. For starters, customers began calling the call center with their complains. The number of complaints rose by a staggering 50% over the previous year. To make matters worse, many of those complaints were never resolved, in fact, in 2023, those unresolved complaints were nearly 50% (45% technically). Personnel turnover increased from 10% to 25%.   ",7,18,,211,1437,
6/11/2025 10:25,6/11/2025 10:32,100,412,1,6/11/2025 10:32,1,3,4,4,4,3,2,4,5,2,2,4,4,4,3,2,4,3,3,2,5,17,7,8,9,4,6,5,3,12,18,1,14,20,13,11,10,19,16,2,15,5,2,4,4,2,3,4,4,5,5,5,5,5,4,5,4,4,5,4,16,11,8,10,18,15,17,14,9,12,2,3,5,7,1,6,19,4,13,"""-3""",3,3,3,3,3,3,3,2,5,7,4,1,6,3,3,3,3,3,3,3,3,3,3,5,2,8,1,7,10,5,6,3,4,9,3,1,"It seems to me that between 2022 and 2023 product quality declined, and/or the company started to treat their employees not well. Between the sales losses, complaints, and turn over, to me it seems something in the culture of the business changed. They aren't retaining people, or customers. You can make a lot of assumptions, like did they swap to ai? Cheaper materials/poor quality of the product? We can't know until we look deeper, but *something* is going on.",3,13,,209,1438,
6/10/2025 12:02,6/10/2025 12:07,100,349,1,6/10/2025 12:07,1,4,5,4,5,4,4,4,5,2,5,3,5,1,4,5,5,4,4,1,2,18,6,15,14,10,16,13,12,4,5,8,2,11,3,9,19,20,7,17,1,5,4,4,5,2,4,4,4,3,4,4,4,5,4,4,3,4,3,4,9,12,14,17,1,5,8,6,10,16,7,3,11,18,15,19,2,13,4,-3,3,4,2,4,2,5,4,1,2,3,5,6,4,7,3,4,4,4,4,2,4,4,4,5,7,2,1,6,9,8,5,4,3,10,5,4,The company is having problems with customer service that is starting to impact their bottom line. Sales have been declining and customers seem to be having more complaints that are not being resolved. This could be due to their higher turn-over rate.,9,18,,243,1439,
6/10/2025 15:56,6/10/2025 16:03,100,432,1,6/10/2025 16:03,1,4,4,4,4,5,4,5,5,2,4,4,4,2,4,4,5,4,5,1,5,14,19,12,5,4,18,11,3,6,16,9,8,13,17,1,2,7,15,20,10,4,4,2,4,2,2,4,3,4,4,2,5,4,4,4,4,5,4,4,2,16,1,9,12,5,13,6,11,3,19,18,14,10,15,8,4,7,17,-3,4,5,5,4,5,4,2,3,5,2,4,7,1,6,2,5,2,5,2,4,5,4,4,5,9,1,8,4,5,3,2,7,6,10,4,1,"This company is not taking care of the employees in regard to supporting them and educating them, therefore sales/profits are down and complaints are up. Some complaints are not even being addressed.",7,15,,248,1440,
6/11/2025 16:30,6/11/2025 16:42,100,680,1,6/11/2025 16:42,1,1,2,2,1,3,1,2,3,2,2,1,3,4,4,2,1,2,2,2,3,19,13,18,20,10,12,3,9,17,4,14,2,16,6,11,8,7,5,1,15,5,3,5,4,3,4,5,4,5,5,4,5,4,4,5,4,4,4,4,9,5,2,18,14,15,7,13,3,6,1,12,4,19,11,8,17,10,16,-3,4,3,4,4,4,5,2,4,3,1,5,7,2,6,4,4,2,3,3,4,3,4,4,5,3,5,4,6,7,2,8,10,9,1,5,1,"The company is facing a problem leading to a loss in sales, unhappy customers, and people quitting. The people quitting implies that the problem with the company is something not being addressed by the people in charge, or rather the problem was caused by the people in charge.",2,27,Medical Supplies Billing,213,1441,
6/10/2025 16:10,6/10/2025 16:33,100,1344,1,6/10/2025 16:33,1,5,5,4,4,5,5,3,5,2,4,4,4,1,4,4,4,4,4,2,5,8,20,14,15,9,17,7,1,13,4,11,10,6,2,3,12,16,5,19,18,4,4,3,4,2,3,4,4,5,4,3,4,4,4,3,4,4,5,5,11,15,8,14,13,19,16,10,17,7,12,9,4,5,6,2,18,1,3,-3,5,4,5,5,5,5,3,5,6,2,1,7,4,3,4,4,4,5,4,4,4,3,5,5,10,8,6,1,3,5,9,7,4,2,1,1,Company sales decreased by 20% as there appeared to be a product problem. Complaints to the call center increased by 50%. In 2022 the company was able to resolve 80% of complaints. 2023 problem resolution dropped to 55%. These numbers may be driven more by the turnover in service personnel than in poor product production. Continuity of customer service seems to have been disrupted. As the knowledge base of service left so did the ability of the company to properly respond to customer needs.,5,21,,251,1442,
