StartDate,EndDate,Progress,Duration (in seconds),Finished,RecordedDate,Informed Consent,Q20_1,Q20_2,Q20_3,Q20_4,Q20_5,Q20_6,Q20_7,Q20_8,Q20_9,Q20_10,Q20_11,Q20_12,Q20_13,Q20_14,Q20_15,Q20_16,Q20_17,Q20_18,Q20_19,Q20_20,Q20_DO_1,Q20_DO_2,Q20_DO_3,Q20_DO_4,Q20_DO_5,Q20_DO_6,Q20_DO_7,Q20_DO_8,Q20_DO_9,Q20_DO_10,Q20_DO_11,Q20_DO_12,Q20_DO_13,Q20_DO_14,Q20_DO_15,Q20_DO_16,Q20_DO_17,Q20_DO_18,Q20_DO_19,Q20_DO_20,Q1_1,Q1_2,Q1_3,Q1_4,Q1_5,Q1_6,Q1_7,Q1_8,Q1_9,Q1_10,Q1_11,Q1_12,Q1_13,Q1_14,Q1_15,Q1_16,Q1_17,Q1_18,Q1_19,Q1_DO_1,Q1_DO_2,Q1_DO_3,Q1_DO_4,Q1_DO_5,Q1_DO_6,Q1_DO_7,Q1_DO_8,Q1_DO_9,Q1_DO_10,Q1_DO_11,Q1_DO_12,Q1_DO_13,Q1_DO_14,Q1_DO_15,Q1_DO_16,Q1_DO_17,Q1_DO_18,Q1_DO_19,Q32,Q22_1,Q22_2,Q22_3,Q22_4,Q22_5,Q22_6,Q22_7,Q22_DO_1,Q22_DO_2,Q22_DO_3,Q22_DO_4,Q22_DO_5,Q22_DO_6,Q22_DO_7,Q21_1,Q21_2,Q21_3,Q21_4,Q21_5,Q21_6,Q21_7,Q21_8,Q21_9,Q21_10,Q21_DO_1,Q21_DO_2,Q21_DO_3,Q21_DO_4,Q21_DO_5,Q21_DO_6,Q21_DO_7,Q21_DO_8,Q21_DO_9,Q21_DO_10,Q24,Q33,Q34,Q29,Q28,Q28_27_TEXT,SC0,TWIN_ID,
6/10/2025 13:10,6/10/2025 13:22,100,691,1,6/10/2025 13:22,1,3,5,3,3,5,3,4,5,2,2,2,3,3,4,5,4,4,4,2,5,15,9,4,2,12,20,14,3,8,17,7,13,16,11,5,6,1,19,10,18,4,4,3,4,3,2,2,3,3,2,2,4,3,3,3,3,5,3,3,13,11,1,16,5,14,12,7,10,8,15,2,9,19,17,4,18,3,6,-3,3,4,3,3,5,4,2,5,6,3,4,7,1,2,3,4,2,4,2,4,4,3,3,5,9,2,8,1,10,5,3,7,6,4,5,1,It looks as though this company is experiencing a higher rate of personnel churn. This may or may not be connected to a higher rate of customer complaints and those complaints not being resolved. It's likely the higher rate of unresolved complaints are leading to a drop in sales. Maybe a problem with quality of product/service or a training problem but I hesitate to guess before knowing more. ,7,27,Telecommunications,228,436,
6/10/2025 10:20,6/10/2025 10:34,100,828,1,6/10/2025 10:34,1,4,4,4,3,4,5,4,3,2,4,2,2,3,2,3,5,3,5,2,3,14,7,2,11,9,1,18,16,10,15,6,20,3,17,19,4,5,13,8,12,4,3,3,4,2,4,3,3,3,4,4,3,3,4,3,4,4,4,3,15,10,19,2,3,13,9,14,5,4,18,11,8,17,7,6,12,16,1,-3,2,3,2,2,2,3,4,4,2,5,7,1,3,6,2,4,2,2,3,3,2,2,4,5,9,4,8,2,5,1,7,10,3,6,3,1,"There are two possible problems. One, there may be product difficulties that are causing a decrease in sales and an increase in the number and severity of customer complaints. This may be prompting the increase in service personnel turn-over. Alternatively, the problem may be originating in the service center, and the increase in turnover may be affecting the number of resolved complaints. If a company now has a poor reputation, sales suffer. ",7,17,,199,437,
6/10/2025 10:39,6/10/2025 10:52,100,758,1,6/10/2025 10:52,1,2,4,4,3,4,4,4,3,2,3,1,4,2,4,5,4,4,5,2,4,19,17,7,10,2,8,4,1,6,18,20,11,3,12,13,9,5,16,15,14,5,4,3,5,1,3,4,4,4,3,5,4,2,3,2,3,5,4,5,19,11,8,6,13,1,10,4,17,7,18,2,16,9,15,3,5,14,12,3,5,5,5,5,5,5,1,7,2,3,1,6,4,5,4,5,1,5,2,5,5,2,5,5,1,8,3,9,2,5,7,4,6,10,2,2,The company has lost a significant amount of money and it appears to be due to a tremendous amount t of complaints ,9,14,,235,439,
6/15/2025 7:10,6/15/2025 7:23,100,776,1,6/15/2025 7:23,1,4,5,5,5,5,4,4,5,2,5,3,3,2,4,4,4,3,4,1,4,4,2,9,3,6,7,11,16,13,19,10,18,12,20,5,15,14,17,1,8,4,4,3,3,1,3,2,4,3,4,2,4,4,3,2,3,4,4,5,2,7,3,8,1,17,19,15,12,18,11,10,5,14,9,6,16,13,4,"""-3""",4,2,5,5,4,5,1,5,1,6,2,7,3,4,3,3,3,4,4,2,4,2,5,5,2,8,4,3,1,5,6,7,10,9,5,4,"Based on the data here, the company is in trouble. In 4 areas of KPIs the performance is lacking. Overall sales are down, complaints are up by a sizable number, the unresolved complaints are also up, and turnover has increased. This could be interpreted as a systemic problem, because both the employee side and the customer side are showing signs of stress. ",5,14,,233,440,
6/11/2025 18:58,6/11/2025 19:17,100,1123,1,6/11/2025 19:17,1,4,4,4,4,4,4,4,4,2,4,2,4,2,4,4,4,4,4,2,4,14,10,3,1,5,11,18,8,16,6,4,7,13,12,9,2,17,20,15,19,4,4,4,4,2,2,4,4,4,4,2,4,4,4,4,4,2,4,4,7,3,10,19,16,18,15,5,11,1,13,9,8,2,14,6,17,4,12,-3,4,4,4,4,4,4,2,3,7,1,4,2,5,6,4,4,4,4,2,4,4,2,4,5,9,6,5,4,10,8,7,2,1,3,4,4,"This company is in need of immediate changes in it's operations with it's current $2 million loss from last year, notwithstanding the service staff turnover undermining the increase in call center complaints.",3,17,,235,441,
6/16/2025 10:11,6/16/2025 10:23,100,733,1,6/16/2025 10:23,1,2,4,4,2,4,5,3,4,2,3,1,3,5,4,4,3,3,2,5,4,19,8,4,18,11,7,9,2,1,12,17,16,6,3,10,20,5,14,15,13,4,3,3,4,1,2,4,4,5,3,3,4,3,4,3,4,4,3,3,9,4,7,12,14,5,10,2,1,13,8,16,6,18,19,11,3,17,15,-3,3,4,4,3,3,4,3,6,4,3,7,5,1,2,2,4,3,2,3,3,2,3,3,5,8,4,2,6,5,1,9,7,10,3,4,2,Sales have dropped by 20% in one year and according to the chart one can assume there is problems with the product judgeing by the increase in complaints and ones not resolved combined with the personnel turnover.  Apparently the company needs to focus on issues with the product and resolve those and then they will have less complaints which in turn will lower the stress level of personnel and increase retainment of employees.,5,19,,203,442,
6/10/2025 8:53,6/10/2025 9:04,100,683,1,6/10/2025 9:04,1,4,5,3,4,4,5,5,5,2,3,5,3,1,4,5,3,4,4,3,5,16,12,13,4,8,2,3,5,20,10,18,14,11,1,6,15,9,19,7,17,4,5,3,4,1,2,3,4,3,4,5,5,4,4,3,3,5,5,4,14,15,16,7,18,6,11,17,4,1,5,19,3,10,2,13,8,9,12,-3,2,3,3,3,2,3,4,1,4,3,5,6,2,7,3,2,4,3,3,3,3,3,3,5,6,5,4,2,8,7,3,9,1,10,5,2,This looks to be a company that is struggling. Sales are down and complaints are way up. There is also higher turnover in personnel. My guess is that this is a very stressful work environment with many unhappy customers. If things for this company continue in this direction there will be major disruptions going forward.,5,19,,225,443,
6/10/2025 14:49,6/10/2025 15:06,100,1027,1,6/10/2025 15:06,1,2,4,2,3,3,4,4,4,2,3,2,3,3,3,3,3,3,3,3,4,11,6,14,15,8,18,4,9,20,19,1,10,3,5,2,13,17,12,16,7,3,2,4,3,2,3,3,3,4,4,5,4,3,2,4,3,3,2,3,4,18,15,12,17,9,11,14,8,1,16,5,7,19,3,2,10,13,6,-3,3,2,3,3,1,3,3,7,4,1,3,2,6,5,3,3,2,2,3,3,3,3,4,5,4,9,1,6,2,5,3,10,7,8,4,1,"Between the time period of 2022 and 2023 the company has dropped from 10 million to 8 million sales. The number of call center complaints has increased from 100k to 150k. The amount of complaints not resolved have rose from 20 percent to 45 percent. And the service personnel turn-over went from 10 percent to 25 percent. Based on this data provided we can assume that the loss of 2 millions is because of the rise of 50 thousand call canter complaints, with 45 percent complaints unresolved.",2,20,,187,446,
6/10/2025 9:10,6/10/2025 9:18,100,467,1,6/10/2025 9:18,1,4,4,3,4,4,5,5,3,2,3,3,4,1,3,4,5,4,4,2,4,12,4,10,19,1,2,6,5,15,3,8,20,16,17,14,11,18,13,9,7,5,3,2,3,1,2,2,5,4,3,2,3,3,2,2,2,5,3,5,7,6,1,11,12,13,15,17,10,2,14,5,9,18,19,8,3,16,4,-3,5,5,5,5,5,5,1,6,2,1,4,3,7,5,4,4,1,4,2,5,5,2,5,5,10,9,8,2,4,6,7,5,1,3,5,1,Sales decreased while the number of customer complaints increased by 50%.  The number of complaints not resolved and the worker turnover has more than doubled.,5,1,,227,447,
6/13/2025 0:58,6/13/2025 1:13,100,885,1,6/13/2025 1:13,1,3,3,3,4,4,4,4,4,2,3,3,4,2,4,2,4,4,4,2,4,14,7,19,2,4,5,11,15,9,8,10,17,3,12,18,1,16,6,13,20,4,5,3,3,2,2,3,4,4,3,3,4,2,4,2,4,2,4,4,6,15,17,18,1,3,11,14,5,4,19,13,2,8,7,12,16,10,9,-3,2,3,4,2,4,4,2,1,7,6,4,2,5,3,4,2,3,2,4,3,2,2,2,5,3,10,9,5,8,6,4,7,2,1,5,4,It seems they have a problem with customer support management. Customers are not getting resposible responses on there concerns. They are having repeat complaints from customers not getting the issue resolved in the first place. They are also having trouble keeping service personnel most likely due to poor product quality and/or bad management. ,7,18,,211,448,
6/10/2025 15:24,6/10/2025 15:47,100,1399,1,6/10/2025 15:47,1,5,5,5,5,5,5,5,5,2,4,3,3,2,3,5,5,4,3,1,5,8,11,5,17,4,2,3,1,6,10,13,20,7,12,18,16,15,14,9,19,3,5,3,5,3,3,1,3,2,1,2,5,3,4,3,4,5,4,5,4,13,19,6,3,12,15,7,9,16,14,8,11,2,17,1,18,5,10,-3,3,3,2,2,3,3,3,1,2,7,3,6,4,5,1,3,3,1,4,1,2,1,2,5,7,2,3,8,10,1,5,6,4,9,5,1,It is possible that there has been some degradation of quality in the product due to personnel turnover resulting in employees that still need training or institutional knowledge. The uptick in complaints and unresolved problems may be caused by a lack of experienced representatives and could even be causing the decline in sales.,6,21,,217,449,
6/16/2025 12:29,6/16/2025 12:37,100,488,1,6/16/2025 12:37,1,4,5,4,5,5,4,5,4,2,3,3,5,1,5,5,5,4,4,2,5,16,17,1,18,13,9,5,6,8,3,10,14,20,12,15,19,7,11,2,4,5,4,5,4,2,2,3,4,3,5,3,5,4,4,3,3,5,5,5,19,4,12,11,3,5,9,8,6,2,1,14,7,10,17,13,15,16,18,-3,5,4,5,5,5,5,1,4,5,1,3,2,7,6,3,5,2,4,1,5,5,2,5,5,10,5,1,8,4,3,6,7,9,2,5,1,"The sales went down in 2023 while complaints went up, the same complaints are not resolved now, turn over going up in the company, the overall performance of this company is negative and they need a make over before it's too late and Sales go null",9,19,,262,450,
6/10/2025 9:13,6/10/2025 9:23,100,604,1,6/10/2025 9:23,1,5,5,5,5,5,3,5,5,2,5,3,5,1,4,5,5,4,5,2,5,11,6,16,18,10,1,14,4,9,15,13,17,12,5,2,20,3,8,7,19,5,5,3,5,2,2,5,3,3,5,3,5,5,4,2,3,4,5,5,7,6,11,1,19,18,2,16,14,3,15,9,5,4,17,8,12,13,10,-3,5,5,5,5,5,5,1,7,5,4,2,1,3,6,4,5,1,5,1,5,5,1,5,5,10,4,5,1,2,9,8,3,7,6,5,1,"This company's sales are down and complaints are up. Something may be wrong with the products or services, or it could be that employees are leaving the company and their replacements are not well trained or as competent at the job that needs to be done. The unresolved complaints are probably due to the employee turnover. But why are employees leaving?",5,15,,260,451,
6/10/2025 9:46,6/10/2025 10:15,100,1759,1,6/10/2025 10:15,1,5,5,5,5,5,5,5,5,2,5,5,2,1,5,4,5,5,5,1,5,5,16,8,19,11,17,2,9,20,4,1,6,10,13,14,15,3,12,7,18,5,5,5,5,1,5,1,5,5,5,1,5,5,5,4,5,5,5,5,13,4,10,7,11,18,12,17,19,15,9,2,6,5,14,1,8,16,3,-3,5,2,5,5,5,5,1,5,7,1,2,3,4,6,3,5,1,5,2,5,5,3,4,5,6,10,7,1,8,5,3,2,9,4,5,1,"This is a table representing comparing key performance of a company between 2022 and 2023.

It shows the sales made by the company, decreasing from $10M in 2022 to $8M in 2023, indicating a significant decline in revenue generated over these years.
However, call center complaints surged from %100K to 150K, indicating a growth in customer displeasure. 
The complaints not resolved increased from 20% to 45%, and service personnel turnover increased from 10% to 25%. These trends show a decline in cu",3,19,,275,452,
6/10/2025 10:51,6/10/2025 11:01,100,564,1,6/10/2025 11:01,1,4,4,4,4,4,5,5,4,2,3,4,4,2,3,3,4,3,3,4,3,11,1,8,14,10,15,17,16,3,12,5,13,18,20,2,6,9,4,7,19,3,4,3,3,2,4,3,4,3,4,4,4,4,2,3,3,4,3,4,11,17,3,7,9,6,10,13,15,8,1,5,18,14,16,4,12,2,19,-3,4,4,3,3,4,3,4,1,7,3,5,2,4,6,3,4,4,4,4,3,4,2,3,5,7,9,5,1,10,3,6,2,4,8,3,2,"The company's sales in 2023 decreased compared to 2022. In contrast, consumer complaints have increased and the ability to resolve those complaints has decreased compared to last year. In terms of service and various aspects, the company is providing worse performance and poor service compared to last year.",3,27,Fashion Design,220,455,
6/10/2025 9:02,6/10/2025 9:11,100,551,1,6/10/2025 9:11,1,2,4,4,3,3,3,4,4,2,3,4,4,2,3,3,5,2,3,2,3,7,5,4,19,11,13,18,9,12,3,16,6,20,10,8,2,15,14,1,17,4,4,3,4,2,4,4,4,4,4,2,4,4,4,3,3,4,3,4,15,5,19,6,14,16,3,4,13,18,11,17,2,1,8,12,9,10,7,-3,4,4,3,3,4,4,3,4,2,1,7,5,3,6,4,4,4,4,4,3,3,3,4,5,10,9,6,4,5,7,8,2,3,1,4,4,"This company is on a negative spiral.  Sales have dropped, complaints have skyrocketed and aren't being resolved.  Good employees are leaving.",3,14,,217,456,
6/10/2025 9:05,6/10/2025 9:21,100,958,1,6/10/2025 9:21,1,3,4,4,3,5,4,5,5,2,4,4,3,3,4,4,5,4,5,3,4,4,20,2,8,18,10,11,17,13,9,1,12,19,14,5,15,6,16,3,7,3,4,3,5,3,2,3,3,4,4,2,4,3,3,2,3,5,4,4,9,13,10,6,19,8,12,16,1,2,14,7,18,11,17,15,3,5,4,-3,5,4,3,5,5,5,1,7,6,1,3,4,2,5,3,5,1,5,1,5,5,1,5,5,2,7,4,3,6,5,9,8,10,1,2,1,"There appears to be very poor management in this company from the ground floor up .   Customers are having problems , and these complaints are NOT being resolved , the call center is becoming over whelmed . Finally customers get tired and find another service , so sales plummet and employees no longer want to work in this environment and leave the company.",1,27,Customer Service ,239,457,
6/10/2025 12:25,6/10/2025 12:51,100,1560,1,6/10/2025 12:51,1,4,3,4,3,3,2,4,4,2,3,3,2,2,3,3,4,4,4,3,4,18,4,1,13,2,15,8,11,7,16,19,6,9,10,5,17,14,3,12,20,4,3,5,4,2,2,3,4,4,4,3,4,4,3,4,3,4,4,3,2,13,12,11,4,6,15,16,10,17,5,8,7,9,1,18,3,14,19,-3,3,3,3,4,4,4,2,7,5,3,4,1,2,6,4,4,2,3,2,4,4,2,4,5,6,10,4,7,1,2,3,9,5,8,4,1,"Sales increased by two million between 2022 and 2023. Therefore, the marketing efforts utilized attracted more conversions. However, the call center compaints increased by 50,000. This means that there are issues within that must be resolved. Maybe it's the products or lack of effective customer service. As a result of the increase in complaints, more complaints within one year was not resolved. Since the service personnel turnover increased, these are problems within the company. ",5,14,,212,458,
6/10/2025 21:05,6/10/2025 21:11,100,390,1,6/10/2025 21:11,1,3,4,2,4,5,4,4,4,2,2,3,4,2,3,4,4,4,5,2,4,7,18,8,10,11,20,9,19,15,16,3,17,6,13,2,4,14,12,5,1,3,5,3,4,2,3,2,3,4,2,3,2,2,2,2,2,4,2,3,4,10,19,16,2,3,6,18,1,17,14,5,15,13,7,9,11,12,8,-3,4,4,3,3,4,4,2,6,1,4,5,7,3,2,2,2,2,3,3,1,4,3,4,5,10,1,8,3,9,5,7,4,6,2,5,4,"The company is cutting costs, corners, and probably staff. It looks like the customers are not liking it and it is showing. It is leading to worse sales and more complaints not being resolved",6,14,,204,460,
6/10/2025 12:57,6/10/2025 13:11,100,828,1,6/10/2025 13:11,1,4,4,5,4,5,5,5,5,2,4,4,4,3,3,5,5,3,5,3,5,5,15,3,1,20,18,6,4,11,16,13,12,7,8,19,2,17,9,14,10,4,3,3,4,2,3,2,4,4,3,3,4,4,3,3,3,4,4,4,15,6,16,8,14,18,12,19,5,11,10,13,9,7,3,2,4,1,17,-3,4,4,3,3,4,5,2,1,7,3,4,2,5,6,4,4,3,3,2,4,4,3,4,5,3,6,8,4,5,1,9,10,7,2,1,2,"This company had a drop of $2M in one year. The number of call center complaints has increased by 50K, the percentage of unresolved complaints rose 25% in one year and the turnover in service personnel has had an increase of 15% in that same time frame.",1,20,,230,462,
6/10/2025 11:14,6/10/2025 11:39,100,1512,1,6/10/2025 11:39,1,2,5,3,4,4,5,5,5,2,3,1,3,3,2,4,4,5,3,2,5,5,8,20,13,15,19,18,10,2,6,1,3,4,7,17,16,12,9,11,14,4,3,2,4,2,4,4,4,4,4,4,4,3,1,4,1,4,3,3,17,10,4,14,3,19,12,2,18,9,13,1,16,7,5,11,15,8,6,-3,3,4,4,2,2,4,3,3,4,2,6,7,1,5,4,3,4,3,4,2,2,4,3,5,2,7,10,9,8,1,4,6,3,5,5,4,This company has reduced sales profit in a year by $2 million. They have also had an increase in call center complaints. An increase of 15% of complaints did not get resolved. Turn-over in service personnel had also increased by 15%.,5,13,,207,464,
6/17/2025 21:41,6/17/2025 21:57,100,987,1,6/17/2025 21:57,1,3,4,3,2,4,5,4,5,2,3,2,2,2,3,4,5,3,5,3,5,8,11,14,5,13,12,19,1,18,15,10,4,17,16,7,6,9,3,2,20,3,3,4,4,2,3,4,3,2,3,5,4,4,2,3,3,3,3,3,10,5,19,12,4,1,15,8,11,14,13,2,16,18,17,7,6,3,9,-3,1,4,1,1,4,2,4,3,6,5,1,4,2,7,3,3,4,4,3,1,2,2,4,5,1,10,6,9,7,4,8,2,3,5,5,1,"From the number of complaints and 20% drop in sales appears that product or service quality has deteriorated from 2022 to 2023.  The large decrease in successful resolution of complaints is also likely to be contributing to the sales drop due to bad publicity and word of mouth.  The high turnover in service personnel may be a cause of the poor complaint resolution rate, or could be a result of ineffective management or poor work culture. ",3,23,,200,466,
6/10/2025 16:22,6/10/2025 16:30,100,478,1,6/10/2025 16:30,1,3,3,2,2,3,4,4,3,2,2,2,3,4,2,2,3,2,4,3,4,20,15,18,14,17,11,5,16,13,12,2,6,9,1,3,19,4,7,8,10,4,3,4,3,2,4,3,4,4,3,3,4,3,2,2,2,4,3,3,15,17,3,19,13,12,18,14,7,4,5,9,2,11,1,6,8,16,10,-3,2,4,4,4,4,4,3,1,6,5,3,2,4,7,4,3,4,3,3,4,4,4,3,5,1,4,8,10,2,3,5,7,9,6,5,1,"This company lost sales from 2022 to 2023 and had 50,000 more call center complaints in 2023 than in 2022. With 45% of the complaints not solved, and a high turnover rate with employees, I can see why sales fell. ",3,18,,198,468,
6/10/2025 14:04,6/10/2025 14:15,100,617,1,6/10/2025 14:15,1,5,5,5,5,5,5,5,5,2,5,4,3,1,5,4,5,4,4,1,5,15,18,20,9,13,2,10,6,4,3,16,5,19,12,7,1,14,17,8,11,4,3,5,4,2,2,1,4,3,3,3,4,3,5,3,5,4,4,4,2,3,14,17,9,12,18,1,10,11,6,13,4,5,8,7,19,15,16,-3,5,5,5,3,3,3,3,3,2,1,5,7,4,6,1,3,4,3,3,3,3,3,2,5,2,10,4,8,7,5,9,3,1,6,1,2,I would say that the company has a problem with it's management. Usually high turn overs are because of bad working environments which almost always comes from management not prioritizing employees over money. Bad managers mean that employees are leaving in high numbers and most likely not doing well at their jobs. Employees not doing well at their jobs would explain all the complaints coming in and the fact that the complaints do not get resolved. All of the above would lead to less sales.,9,13,,232,471,
6/11/2025 3:37,6/11/2025 4:00,100,1390,1,6/11/2025 4:00,1,4,4,3,4,4,4,4,4,2,3,3,4,2,3,4,4,4,4,4,4,10,13,12,14,11,7,15,4,17,19,6,1,16,20,8,3,9,5,2,18,3,3,2,2,4,2,2,2,2,3,2,3,2,3,2,2,2,2,3,9,1,8,10,13,2,14,7,17,5,4,12,6,16,19,18,3,11,15,-3,4,4,4,4,4,4,3,4,6,5,3,2,7,1,3,3,3,3,4,4,3,3,4,5,6,5,7,3,8,2,10,9,4,1,5,1,"Company is loosing focus on customer service. Sales are down while complaints are up. The complaints not resolved increase ties directly to the turn-over in service personnel. Stress for everyone involved has to be high. This company will not survive if they do not return to the basics of whatever their business is. The old adage of ""the customer is always right"" shows where they must direct their energy. First I would tackle the ""complaints not resolved issue which will solve the turnover.",9,16,,200,472,
6/10/2025 10:05,6/10/2025 10:11,100,369,1,6/10/2025 10:11,1,4,5,3,3,3,3,5,4,2,4,1,4,2,1,5,5,5,4,3,4,20,6,15,10,13,7,12,11,5,19,18,16,17,3,1,14,2,4,8,9,4,4,3,4,2,3,4,4,3,4,4,4,4,3,2,3,4,4,3,8,15,10,14,17,18,11,9,3,1,6,12,2,4,16,7,5,13,19,-3,3,4,3,2,2,3,5,6,4,3,2,5,7,1,2,2,4,2,5,3,2,4,4,5,8,4,1,3,2,6,9,5,7,10,5,2,"The company is not providing customer service employees with incentives to remain and continue working for the company.  This results in the better employees leaving the company and the less stellar employees having to make up the difference.  This in turns causes many complaints to go unresolved, increases the complaints, and eventually leads to a downturn in sales.",7,14,,205,473,
6/13/2025 11:52,6/13/2025 12:01,100,517,1,6/13/2025 12:01,1,5,3,5,5,5,3,5,5,2,5,4,5,1,4,5,5,2,5,5,5,20,6,3,18,11,13,16,7,19,4,8,9,14,2,12,1,5,15,17,10,5,5,4,5,2,5,4,5,5,5,1,5,5,5,4,5,5,5,5,12,4,17,18,19,13,15,2,10,8,7,3,14,1,6,9,16,11,5,-3,3,3,5,3,4,4,2,3,6,1,7,5,4,2,4,5,4,5,1,5,5,3,5,5,1,6,2,10,9,8,5,7,4,3,5,4,"Judging from the chart, the company is doing worse in 2023 than what it did in 2022. Sales dropped, more customers are complaining, and almost half of those complaints are being addressed. On top of that a lot of service personnel are quitting. It looks like people are unhappy across the board, and that includes both workers and customers. This hurts the business.",3,17,,268,474,
6/10/2025 8:53,6/10/2025 9:14,100,1263,1,6/10/2025 9:14,1,4,5,3,3,3,4,3,2,2,2,1,3,2,3,5,5,3,3,3,3,8,20,11,1,9,5,2,7,15,17,13,6,19,10,16,4,18,12,3,14,2,3,2,3,2,3,2,3,3,2,5,3,4,1,2,1,4,2,3,10,17,15,13,7,3,9,12,11,6,19,1,18,16,8,2,14,4,5,-3,5,2,5,5,4,5,2,4,7,3,5,2,1,6,2,5,5,4,2,3,5,2,5,5,7,9,6,4,8,10,1,2,3,5,5,1,"The company seems to be going through tough times.  It is impossible to say what exactly is causing this trend.  Perhaps their quality went down, or management changed and new policies were implemented that people did not like.  A much higher percentage of people are calling and complaining, and the complaints largely are not getting resolved.",9,21,,209,475,
6/10/2025 9:09,6/10/2025 9:16,100,417,1,6/10/2025 9:16,1,5,5,4,5,5,5,5,5,2,4,5,5,1,5,5,5,5,5,1,5,4,3,8,12,1,5,20,18,2,7,11,9,19,16,13,10,15,17,6,14,4,5,1,5,4,1,1,2,1,4,1,3,1,4,3,4,4,3,4,12,19,1,9,5,17,10,11,7,3,6,15,16,2,4,18,13,8,14,-3,2,1,2,2,2,4,5,7,6,1,5,4,2,3,4,3,2,1,5,2,2,1,2,5,9,1,5,6,4,8,3,7,2,10,5,1,"The company has had a slight dip in sales and a sharp increase in call center complaints. Perhaps due to the increased turnover in service personnel, has seen a significant increase in those complaints being unresolved. Overall, the company is not doing as well in 2023 as it did in 2022.",4,14,,205,476,
6/10/2025 9:53,6/10/2025 10:33,100,2395,1,6/10/2025 10:33,1,5,2,4,4,5,2,2,4,2,4,4,4,1,4,4,5,2,4,2,2,7,18,12,6,8,17,5,9,16,14,3,1,19,20,13,15,10,2,4,11,2,4,2,2,2,2,2,4,4,4,5,4,4,2,2,2,4,4,4,2,15,3,4,7,8,10,18,19,9,17,16,14,11,1,12,13,5,6,-3,2,4,3,1,4,4,2,5,1,2,4,6,3,7,4,2,1,4,2,4,2,1,4,5,5,8,3,10,6,1,7,9,4,2,5,1,Sales is going down probaly because of faulty product. There is a direct correlation between sales and call center complaints and personnell turnover. When you have a lot of complaints and a lot of turnover your sales are going to suffer. When this takes place the date is overwelming that the sales of products will go down. There is no escaping it. Also the complaints not resolved is a direct result of this whole situation.Forty five percent is a very high number.  I am surprised sales didnt suf,6,21,,207,477,
6/10/2025 11:35,6/10/2025 11:52,100,1035,1,6/10/2025 11:52,1,5,5,5,5,5,4,5,5,2,5,4,4,1,4,5,5,4,5,1,5,3,13,15,11,18,14,20,10,7,8,16,1,17,19,12,9,4,5,6,2,4,4,2,3,2,2,2,4,3,4,3,5,3,5,2,4,4,4,5,16,18,1,10,12,5,17,8,3,7,15,9,6,4,14,19,2,11,13,-3,4,3,4,5,5,4,1,1,4,2,3,7,5,6,2,4,1,5,1,5,5,1,5,5,8,5,4,3,10,6,7,1,9,2,5,1,"The company saw a big drop in performance between 2022 and 2023. Sales fell by 20% from $10 million to $8 million, and customer complaints shot up by 50%. Unresolved issues increased from 20% to 45%, showing a decline in customer service. Service staff turnover also more than doubled, going from 10% to 25%, hinting at internal problems. These trends suggest both operational and customer service issues that could be hurting revenue. ",7,21,,253,478,
6/12/2025 11:39,6/12/2025 12:22,100,2583,1,6/12/2025 12:22,1,4,4,4,4,4,3,3,4,2,4,3,4,3,3,4,3,4,3,4,3,5,7,10,8,11,14,20,3,13,19,15,4,17,9,18,12,1,6,16,2,4,4,4,4,4,3,3,5,4,4,4,3,5,4,3,3,4,4,4,14,18,6,15,17,5,16,12,7,1,4,19,8,13,2,10,11,9,3,-3,4,3,3,3,3,4,4,6,4,5,7,2,1,3,4,3,3,4,4,4,4,4,3,5,3,4,7,8,6,9,5,2,10,1,3,1,"looking at the figure above, this means that the company's sales is declining and as compared by 2022 and 2023 the company made a loss of 2 million dollars. 
Also the call center complaint increase by some 50k customers this means that the firm was moving towards the wrong direction. this is that if things were going on smoothly the complaint wouldn't have increased like that. also the company wasn't able to handle the complaints of the customers very well. so the overall impression was very bad",4,16,,211,479,
6/10/2025 8:55,6/10/2025 9:25,100,1766,1,6/10/2025 9:25,1,2,4,4,4,4,4,5,4,4,4,2,3,2,4,5,4,2,5,2,5,9,18,8,16,7,1,19,3,17,2,20,6,15,12,4,13,5,11,10,14,4,4,3,4,1,4,4,4,5,2,2,3,4,3,3,5,5,4,5,4,6,17,11,13,16,9,10,8,5,12,7,19,14,3,2,1,15,18,-3,4,2,3,4,5,5,1,3,1,5,4,7,6,2,4,4,2,4,2,5,5,3,5,5,6,10,2,3,5,1,9,4,8,7,2,4,as the sales for a company started to drop due to all center complaints. the complaints nearly doubled the next year and business has been droping during sex. on top of all that thje complaints almost doubled. i dont think im gonna be dealing with this company every morning.,1,12,,232,480,
6/10/2025 9:32,6/10/2025 9:39,100,407,1,6/10/2025 9:39,1,3,1,1,2,3,4,3,1,2,1,2,1,5,2,2,4,2,2,1,4,2,6,8,5,20,11,18,16,9,17,7,10,14,3,13,19,15,1,12,4,2,3,2,1,2,2,2,4,3,2,2,4,2,2,3,3,1,4,1,5,10,9,4,15,3,11,7,17,18,19,1,8,16,14,6,12,13,2,-3,4,3,2,2,3,3,4,3,1,5,6,7,4,2,3,2,3,2,3,3,3,4,4,5,4,2,10,8,7,3,9,1,5,6,1,1,They are losing customers and not delivering on what they say. They will continue to decline until they are bankrupt and have to close. They need to implement some changes if they want to stay in business. They also seem to have some sort of problem with solving the issues that are being brought up. I think that they need to train their people better to handle any kind of situation that might arise in dealing with customers. ,1,27,Babysitter/Freelance,168,481,
6/10/2025 9:48,6/10/2025 9:57,100,501,1,6/10/2025 9:57,1,4,4,4,4,4,4,4,3,2,3,3,4,4,4,3,3,4,3,4,3,10,18,12,13,5,8,7,6,16,2,14,3,20,1,17,11,19,9,15,4,2,3,3,4,4,3,4,4,4,4,4,3,4,3,3,3,4,2,3,4,6,13,1,15,9,7,12,3,14,11,8,19,10,16,18,17,5,2,-3,3,3,4,4,4,3,4,6,4,7,5,2,3,1,4,4,4,4,4,4,3,3,3,5,3,8,10,5,6,1,7,2,4,9,3,1,"At the first year 2022 the company keep a good record of both sales, call center complains, complain not resolved and service personal turn over than the year 2023",4,19,,205,482,
6/10/2025 14:39,6/10/2025 14:46,100,434,1,6/10/2025 14:46,1,4,4,4,4,4,5,5,5,2,4,4,2,4,2,2,4,4,4,2,5,17,19,12,18,11,1,7,9,3,15,2,13,5,20,6,16,10,14,4,8,4,2,2,4,4,2,2,2,4,2,4,2,4,2,2,2,4,2,4,7,18,19,3,16,6,2,12,1,4,13,9,8,5,11,15,10,17,14,-3,5,5,5,5,5,5,2,1,4,6,3,2,7,5,2,5,2,2,5,5,5,2,5,5,9,3,7,8,6,2,1,10,5,4,5,2,This company is doing worse in my opinion- they are having a higher number of employee turnover and customer issues while also seeing a decline in overall sales. Someone at the top needs to take a serious look at the overall structure and what has changed in the past year so that they can correct this issue before it completely bankrupts them. ,3,11,,205,483,
6/14/2025 11:45,6/14/2025 11:55,100,631,1,6/14/2025 11:55,1,3,5,4,3,5,5,5,5,2,4,3,4,5,3,4,4,5,5,3,5,11,6,18,3,2,13,8,20,16,4,7,15,17,5,14,12,10,1,19,9,3,5,2,4,1,2,3,4,4,3,5,5,5,4,5,4,5,5,5,4,9,14,2,15,11,3,17,6,12,18,5,13,16,10,8,1,19,7,-3,4,5,5,5,5,5,1,2,6,5,1,4,7,3,1,5,2,5,1,5,5,2,5,5,6,10,3,8,4,2,7,5,1,9,5,2,"From 2022 to 2023, the company noticed a reduction in sales by $2M, an increase in 50,000 call center complaints, including an inrease of 25% in the company's leaving complaints unresolved, and an increase of 15% in service personal turnover. This suggests that the company did not do better the following year, or may have experienced an issue.",5,23,,253,484,
